data,dia_semana,hora,natureza,bairro,logradouro_endereco,endereco,logradouro_detalhe_endereço,detalhe_endereco_acidente,complemento,bairro_cruzamento,num_semaforo,sentido_via,tipo,auto,moto,ciclom,ciclista,pedestre,onibus,caminhao,viatura,outros,vitimas,vitimasfatais,acidente_verificado,tempo_clima,situacao_semaforo,sinalizacao,condicao_via,conservacao_via,ponto_controle,situacao_placa,velocidade_max_via,mao_direcao,divisao_via1,divisao_via2,divisao_via3
2023-08-01,terça-feira ,02:19:00,COM VÍTIMA,ILHA DO LEITE,RUA,RUA FRANCISCO ALVES,,,ESTAC. SAN PARK,ILHA DO LEITE,,,COLISÃO LATERAL,1,1,0,0,0,0,0,0,0,1,0,,,,,,,,,,,,,
2023-08-01,terça-feira ,02:19:00,COM VÍTIMA,ESPINHEIRO,AVENIDA,AVENIDA GOVERNADOR AGAMENON MAGALHAES,,,UPE / MINISTÉRIO DO TRABALHO,ESPINHEIRO,,,COLISÃO LATERAL,1,1,0,0,0,0,0,0,0,1,0,,,,,,,,,,,,,
2023-08-01,terça-feira ,02:30:00,SEM VÍTIMA,AGUA FRIA,EST,EST VELHA DE AGUA FRIA,,,IGREJA PENTECOSTAL DO BRASIL,AGUA FRIA,,,COLISÃO LATERAL,1,0,0,0,0,0,0,1,0,0,0,,,,,,,,,,,,,
2023-08-01,terça-feira ,04:30:00,COM VÍTIMA,BOA VISTA,AVENIDA,AVENIDA JOAO DE BARROS,,,EM FRENTE A NEO ENERGIA,BOA VISTA,,,COLISÃO LATERAL,0,0,0,0,0,0,0,0,0,1,0,,,,,,,,,,,,,
2023-08-01,terça-feira ,05:14:00,SEM VÍTIMA,ALTO SANTA TERESINHA,RUA,RUA ALTO JOSE BONIFACIO,,,NO TERMINAL  DE ONIBUS,ALTO SANTA TERESINHA,,,COLISÃO TRASEIRA,2,0,0,0,0,0,0,0,0,0,0,,,,,,,,,,,,,
2023-08-01,terça-feira ,05:15:00,COM VÍTIMA,IBURA,AVENIDA,AVENIDA RECIFE,,,ARMAZEM CORAL,IBURA,,,COLISÃO LATERAL,0,0,0,0,0,0,0,0,0,1,0,,,,,,,,,,,,,
2023-08-01,terça-feira ,06:53:00,COM VÍTIMA,CAXANGA,AVENIDA,AVENIDA CAXANGA,,,UPA CAXANGÁ,CAXANGA,,,COLISÃO LATERAL,0,0,0,0,0,0,0,0,0,1,0,,,,,,,,,,,,,
2023-08-01,terça-feira ,07:28:00,COM VÍTIMA,CAMPO GRANDE,RUA,RUA JERONIMO VILELA,,,PRÓXIMO AO MERCADINHO BOM JESUS,CAMPO GRANDE,,,ATROPELAMENTO DE PESSOA,0,1,0,0,0,0,0,0,0,1,0,,,,,,,,,,,,,
2023-08-02,quarta-feira ,07:00:00,COM VÍTIMA,TORROES,AVENIDA,AVENIDA ENGENHEIRO ABDIAS DE CARVALHO,,,EM FRENTE A DLT APOS O POSTO DA ABDIAS, E PROX AO POSTO SHELL,TORROES,,,COLISÃO FRONTAL,0,1,0,0,0,0,0,0,0,1,0,,,,,,,,,,,,
2023-08-02,quarta-feira ,08:43:00,COM VÍTIMA,ILHA DO RETIRO,RUA,RUA TABAIARES,,,ED. RITA DE CASIA,ILHA DO RETIRO,,,ATROPELAMENTO DE PESSOA,1,0,0,0,1,0,0,0,0,1,0,,,,,,,,,,,,,
2023-08-02,quarta-feira ,09:33:00,COM VÍTIMA,SOLEDADE,RUA,RUA DO PRINCIPE,,,PROX A UNIVERSIDADE A CATOLICA,SOLEDADE,,,COLISÃO FRONTAL,0,1,0,0,0,0,0,0,0,1,0,,,,,,,,,,,,,
2023-08-02,quarta-feira ,10:23:00,COM VÍTIMA,IPSEP,AVENIDA,AVENIDA SALDANHA MARINHO,,,VINDO PELA AV RECIFE  SENTIDO CIDADE UNIVERSITARIA,IPSEP,,,COLISÃO LATERAL,1,1,0,0,0,0,0,0,0,1,0,,,,,,,,,,,,,
2023-08-02,quarta-feira ,12:25:00,COM VÍTIMA,NOVA DESCOBERTA,RUA,RUA CORREGO DA AREIA,,,PROXIMO A PADARIA ADRIANA E TERMINAL DO CORREGO DA AREIA,NOVA DESCOBERTA,,,QUEDA,0,1,0,0,0,0,0,0,0,1,0,,,,,,,,,,,,,
2023-08-02,quarta-feira ,12:47:00,COM VÍTIMA,CURADO,BR,BR 101 (DENTRO DA CEASA),,,DENTRO DA CEASA/ EM FRENTE A LOJA LIBE10,CURADO,,,COLISÃO LATERAL,1,2,0,0,1,0,0,0,0,2,0,,,,,,,,,,,,,
2023-08-02,quarta-feira ,02:03:00,SEM VÍTIMA,SANTO ANTONIO,AVENIDA,AVENIDA MARTINS DE BARROS,,,EM FRENTE AO FORUM THOMAZ DE AQUINO,SANTO ANTONIO,,,COLISÃO LATERAL,1,0,0,0,0,0,1,0,0,0,0,,,,,,,,,,,,,
2023-08-02,quarta-feira ,02:47:00,SEM VÍTIMA,BOA VISTA,RUA,RUA JOAO FERNANDES VIEIRA,,,EM FRENTE AO HAPVIDA,BOA VISTA,,,COLISÃO LATERAL,1,0,0,0,0,0,0,1,0,0,0,,,,,,,,,,,,,
2023-08-02,quarta-feira ,03:15:00,COM VÍTIMA,SAO JOSE,AVENIDA,AVENIDA SUL,,,APOS O PONTILHAO DO METYRO E/F A PORTELA  MATERIAL DE CONSTRUÇOES,SAO JOSE,,,COLISÃO TRASEIRA,0,2,0,0,0,0,0,0,0,1,0,,,,,,,,,,,,,
2023-08-02,quarta-feira ,03:27:00,COM VÍTIMA,CASA AMARELA,AVENIDA,AVENIDA NORTE MIGUEL ARRAES DE ALENCAR,,,ANTES DA IGREJA DO AMOR,CASA AMARELA,,,COLISÃO LATERAL,0,0,0,0,0,0,0,0,0,1,0,,,,,,,,,,,,,
2023-08-02,quarta-feira ,03:31:00,COM VÍTIMA,ESPINHEIRO,RUA,RUA SAO SALVADOR,,,AO LADO DO HOSPITAL DOS SERVIDORES,ESPINHEIRO,,,ATROPELAMENTO DE PESSOA,1,0,0,0,1,0,0,0,0,1,0,,,,,,,,,,,,,
2023-08-02,quarta-feira ,03:35:00,COM VÍTIMA,CASA FORTE,AVENIDA,AVENIDA DEZESSETE DE AGOSTO,,,MCDONALDS,CASA FORTE,,,COLISÃO LATERAL,0,0,0,0,0,0,0,0,0,1,0,,,,,,,,,,,,,
2023-08-02,quarta-feira ,04:35:00,COM VÍTIMA,DOIS UNIDOS,AVENIDA,AVENIDA HILDEBRANDO DE VASCONCELOS,,,COLÉGIO F. PESSOA DE QUEIROZ,DOIS UNIDOS,,,QUEDA,0,0,0,0,0,0,0,0,0,1,0,,,,,,,,,,,,,
2023-08-02,quarta-feira ,06:52:00,COM VÍTIMA,IPSEP,AVENIDA,AVENIDA RECIFE,,,SAL E BRASA,IPSEP,,,COLISÃO LATERAL,0,1,0,0,0,0,0,0,0,1,0,,,,,,,,,,,,,
2023-08-02,quarta-feira ,07:52:00,COM VÍTIMA,CAXANGA,RUA,RUA RIBEIRO PESSOA,,,A MAIS OU MENOS A 100 METROS DA UPA DA CAXANGA,CAXANGA,,,COLISÃO FRONTAL,0,1,0,0,0,1,0,0,0,1,0,,,,,,,,,,,,,
2023-08-02,quarta-feira ,08:02:00,COM VÍTIMA,CORDEIRO,RUA,RUA DR JOAO LACERDA,,,PRÓXIMO À DHPP,CORDEIRO,,,COLISÃO TRANSVERSAL,0,1,0,0,0,0,0,0,0,1,0,,,,,,,,,,,,,
2023-08-02,quarta-feira ,08:04:00,COM VÍTIMA,MADALENA,RUA,RUA JOSE OSORIO,,,APÓS O MERC DA MADALENA - E/F À CONCESSIONÁRIA TEIXEIRA,MADALENA,,,COLISÃO TRANSVERSAL,0,1,0,0,0,0,0,0,0,1,0,,,,,,,,,,,,,
2023-08-03,quinta-feira ,01:33:00,COM VÍTIMA,PARNAMIRIM,AVENIDA,AVENIDA PARNAMIRIM,RUA,RUA SAO SEBASTIAO,PROXIMO À PONTE DA TORRE/CARREFOUR,PARNAMIRIM,10,,COLISÃO TRANSVERSAL,2,0,0,0,0,0,0,0,0,1,0,,,,,,,,,,,,,
2023-08-03,quinta-feira ,07:47:00,COM VÍTIMA,SAO JOSE,AVENIDA,AVENIDA SUL,,,SEMÁFARO 260,SAO JOSE,,,COLISÃO LATERAL,1,1,0,0,0,0,0,0,0,1,0,,,,,,,,,,,,,
2023-08-03,quinta-feira ,07:54:00,COM VÍTIMA,ESPINHEIRO,AVENIDA,AVENIDA GOVERNADOR AGAMENON MAGALHAES,,,NA DECIDA DO VIATUDO AGAMENON MAGALHAES / PROX AO EMPRESARIAL AGAMENON MAGALHAES E PROX AO SEMAFORO 711,ESPINHEIRO,,,COLISÃO TRASEIRA,1,1,0,0,0,0,0,0,0,1,0,,,,,,,,,,,,,
2023-08-03,quinta-feira ,08:03:00,COM VÍTIMA,ENCRUZILHADA,RUA,RUA DONA ELVIRA,,,PROX A MARTENIDADE CISAM / PROX AO SUPERMERCADO QUINTADARIA,ENCRUZILHADA,,,COLISÃO FRONTAL,1,1,0,0,0,0,0,0,0,1,0,,,,,,,,,,,,,
2023-08-03,quinta-feira ,08:27:00,COM VÍTIMA,JOANA BEZERRA,VIADUTO,VIADUTO CAPITAO TEMUDO,,,COMEÇO DO VIADUTO SENTIDO BOA VIAGEM / PROX AO FORUM DE JOANA BEZERRA,JOANA BEZERRA,,,COLISÃO LATERAL,1,1,0,0,0,0,0,0,0,1,0,,,,,,,,,,,,,
2023-08-03,quinta-feira ,08:37:00,COM VÍTIMA,SAO JOSE,PTE,PTE SEIS DE MARCO,,,EM CIMA DA PONTE VELHA / PROX A CASA DA CULTURA,SAO JOSE,,,COLISÃO FRONTAL,0,1,0,0,0,0,0,0,0,1,0,,,,,,,,,,,,,
2023-08-03,quinta-feira ,09:23:00,COM VÍTIMA,IMBIRIBEIRA,AVENIDA,AVENIDA SUL,,,ATRÁS DA LOJA CAOA CHERY / PROX A ESTAÇÃO DE METRO DA IMBIRIBEIRA,IMBIRIBEIRA,,,COLISÃO COM CICLISTA,1,0,0,1,0,0,0,0,0,1,0,,,,,,,,,,,,,
2023-08-03,quinta-feira ,09:50:00,COM VÍTIMA,BOA VISTA,AVENIDA,AVENIDA GOVERNADOR AGAMENON MAGALHAES,AVENIDA,AVENIDA RUI BARBOSA,TRIBUNAL ELEITORAL,BOA VISTA,,,COLISÃO TRASEIRA,1,1,0,0,0,0,0,0,0,1,0,,,,,,,,,,,,,
2023-08-03,quinta-feira ,10:21:00,COM VÍTIMA,SANTO AMARO,RUA,RUA DA AURORA,,,REF: APOIO AO SUB SÓSTENES: REF: TRIBUNAL DE CONTAS,SANTO AMARO,,,COLISÃO TRASEIRA,1,1,0,0,0,0,0,0,0,1,0,,,,,,,,,,,,,
2023-08-03,quinta-feira ,12:11:00,COM VÍTIMA,VASCO DA GAMA,AVENIDA,AVENIDA VEREADOR OTACILIO AZEVEDO,,,ESCOLA IRMÃ MAGNA,VASCO DA GAMA,,,COLISÃO LATERAL,1,1,0,0,0,0,0,0,0,1,0,,,,,,,,,,,,,
2023-08-03,quinta-feira ,12:55:00,COM VÍTIMA,SANTO AMARO,AVENIDA,AVENIDA MARIO MELO,,,AO LADO DO COLEGIO IEP,SANTO AMARO,171,,COLISÃO LATERAL,2,1,0,0,0,0,0,0,0,1,0,,,,,,,,,,,,,
2023-08-03,quinta-feira ,01:57:00,COM VÍTIMA,BOA VIAGEM,RUA,RUA DEZ DE JULHO,,,METRÔ AEROPORTO,BOA VIAGEM,,,COLISÃO LATERAL,1,1,0,0,0,0,0,0,0,1,0,,,,,,,,,,,,,
2023-08-03,quinta-feira ,02:47:00,COM VÍTIMA,DOIS IRMAOS,RUA,RUA DOIS IRMAOS,,,E/F AO SOBRADO CARLOS PENA FILHO  E A FUNDAÇAO GILBERTO FREIRE,DOIS IRMAOS,,,COLISÃO LATERAL,1,1,0,0,0,0,0,0,0,1,0,,,,,,,,,,,,,
2023-08-03,quinta-feira ,03:15:00,COM VÍTIMA,IMBIRIBEIRA,AVENIDA,AVENIDA GENERAL MAC ARTHUR,,,EM FRENTE A DO FRIO,IMBIRIBEIRA,,,COLISÃO TRASEIRA,1,1,0,0,0,0,0,0,0,1,0,,,,,,,,,,,,,
2023-08-03,quinta-feira ,03:36:00,SEM VÍTIMA,MADALENA,AVENIDA,AVENIDA ENGENHEIRO ABDIAS DE CARVALHO,,,MCDONALDS,MADALENA,,,COLISÃO LATERAL,1,0,0,0,0,0,0,1,0,0,0,,,,,,,,,,,,,
2023-08-03,quinta-feira ,05:06:00,COM VÍTIMA,IMBIRIBEIRA,AVENIDA,AVENIDA MARECHAL MASCARENHAS DE MORAES,,,ALÇA DE RETORNO DO VIADUTO, PROXIMO A UNIDAS ALUGUEL DE CARROS,IMBIRIBEIRA,,,TOMBAMENTO,0,1,0,0,0,0,0,0,0,1,0,,,,,,,,,,,,
2023-08-03,quinta-feira ,06:42:00,COM VÍTIMA,MADALENA,RUA,RUA BENFICA,,,BATALHÃO DE CHOQUE,MADALENA,,,COLISÃO LATERAL,0,1,0,0,0,0,0,1,0,1,0,,,,,,,,,,,,,
2023-08-03,quinta-feira ,09:58:00,COM VÍTIMA,SANTO AMARO,AVENIDA,AVENIDA CRUZ CABUGA,,,PROXIMO AO SHOPPING TACARUNA,SANTO AMARO,,,COLISÃO LATERAL,0,1,0,0,0,0,0,0,0,1,0,,,,,,,,,,,,,
2023-08-03,quinta-feira ,09:58:00,COM VÍTIMA,ENCRUZILHADA,AVENIDA,AVENIDA BEBERIBE,,,PROX. À ACADEMIA MATCH FIT. EM FRENTE À CLÍNICA OK DOUTOR,ENCRUZILHADA,,,COLISÃO LATERAL,0,1,0,0,0,0,0,0,0,1,0,,,,,,,,,,,,,
2023-08-04,sexta-feira ,06:33:00,COM VÍTIMA,IPUTINGA,AVENIDA,AVENIDA MAURICIO DE NASSAU,,,EM FRENTE AO ALTINO VENTURA,IPUTINGA,,,QUEDA,0,1,0,0,0,0,0,0,0,1,0,,,,,,,,,,,,,
2023-08-04,sexta-feira ,08:33:00,COM VÍTIMA,SANTO AMARO,RUA,RUA DOS PALMARES,RUA,RUA TREZE DE MAIO,PROX AO SINDICATO DOS ADVOGADOS,SANTO AMARO,,,COLISÃO FRONTAL,0,2,0,0,0,0,0,0,0,1,0,,,,,,,,,,,,,
2023-08-04,sexta-feira ,09:18:00,COM VÍTIMA,ARRUDA,AVENIDA,AVENIDA PROFESSOR JOSE DOS ANJOS,,,PROX AO ARMAZEM CASA E CONSTRUÇÃO E NA BEIRA DO CANAL,ARRUDA,,,ATROPELAMENTO DE PESSOA,0,1,0,0,1,0,0,0,0,1,0,,,,,,,,,,,,,
2023-08-04,sexta-feira ,09:32:00,COM VÍTIMA,SANTO AMARO,AVENIDA,AVENIDA NORTE MIGUEL ARRAES DE ALENCAR,,,SOBRE PONTE LIMOEIRO,SANTO AMARO,,,COLISÃO TRANSVERSAL,0,1,0,0,0,0,0,0,0,1,0,,,,,,,,,,,,,
2023-08-04,sexta-feira ,09:37:00,COM VÍTIMA,NOVA DESCOBERTA,RUA,RUA NOVA DESCOBERTA,,,APOS O LARGO DONA REGINA / PROX A MILA MULTIMARCAS,NOVA DESCOBERTA,,,COLISÃO FRONTAL,0,1,0,0,0,0,0,0,0,1,0,,,,,,,,,,,,,
2023-08-04,sexta-feira ,11:34:00,COM VÍTIMA,ROSARINHO,AVENIDA,AVENIDA SANTOS DUMONT,,,EM FRENTE A CASA ROSADA / EM FRENTE AO COND CASA ROSADA,ROSARINHO,,,COLISÃO FRONTAL,0,1,0,0,0,0,0,0,0,1,0,,,,,,,,,,,,,
2023-08-04,sexta-feira ,02:41:00,COM VÍTIMA,BOA VISTA,AVENIDA,AVENIDA CONDE DA BOA VISTA,,,POSTO BR,BOA VISTA,,,COLISÃO LATERAL,0,0,0,0,0,0,0,0,0,1,0,,,,,,,,,,,,,
2023-08-04,sexta-feira ,04:24:00,COM VÍTIMA,CASA AMARELA,RUA,RUA PADRE LEMOS,,,CENTRO COMERCIAL CASA AMARELA,CASA AMARELA,,,ATROPELAMENTO DE PESSOA,0,1,0,0,1,0,0,0,0,1,0,,,,,,,,,,,,,
2023-08-04,sexta-feira ,06:10:00,COM VÍTIMA,IMBIRIBEIRA,RUA,RUA GENERAL GOES MONTEIRO,,,PADARIA PAN PINHEIROS,IMBIRIBEIRA,,,COLISÃO LATERAL,0,0,0,0,0,0,0,0,0,1,0,,,,,,,,,,,,,
2023-08-04,sexta-feira ,06:15:00,COM VÍTIMA,SOLEDADE,AVENIDA,AVENIDA JOAO DE BARROS,,,,SOLEDADE,,CIDADE,ATROPELAMENTO DE PESSOA,0,0,0,0,1,0,0,0,0,1,0,,,,,,,,,,,,,
2023-08-04,sexta-feira ,06:42:00,COM VÍTIMA,BOA VIAGEM,AVENIDA,AVENIDA ARMINDO MOURA,,,EM FRENTE AO POSTO BR  E A CHURRASCARIA CAIPIRA DRILL,BOA VIAGEM,,,COLISÃO LATERAL,1,1,0,0,0,0,0,0,0,1,0,,,,,,,,,,,,,
2023-08-04,sexta-feira ,09:32:00,COM VÍTIMA,IPUTINGA,AVENIDA,AVENIDA CAXANGA,,,E/F À LANCHONETE SUBWAY - SENTIDO SUBURBIO,IPUTINGA,,,COLISÃO TRANSVERSAL,1,1,0,0,0,0,0,0,0,1,0,,,,,,,,,,,,,
2023-08-04,sexta-feira ,11:08:00,COM VÍTIMA,VARZEA,RUA,RUA GENERAL POLIDORO,,,CLINICA VETERINARIA POLIVETI,VARZEA,,,COLISÃO FRONTAL,1,1,0,0,0,0,0,0,0,1,0,,,,,,,,,,,,,
2023-08-05,sábado ,01:45:00,COM VÍTIMA,VASCO DA GAMA,RUA,RUA VASCO DA GAMA,,,E/F À ARENA BOLA DE OURO,VASCO DA GAMA,,,COLISÃO LATERAL,0,1,0,0,0,0,0,0,0,1,0,,,,,,,,,,,,,
2023-08-05,sábado ,10:24:00,COM VÍTIMA,IMBIRIBEIRA,RUA,RUA DEZ DE JULHO,,,PX AO AEROPORTO // PX A LOJA ALUGUE BRASIL // APOS O TI AEROPORTO,IMBIRIBEIRA,,,COLISÃO LATERAL,0,1,0,0,0,0,0,0,0,1,0,,,,,,,,,,,,,
2023-08-05,sábado ,10:58:00,COM VÍTIMA,TEJIPIO,AVENIDA,AVENIDA DR JOSE RUFINO,,,EM FRENTRE A ESTAÇÃO DE METRO TEJIPIO,TEJIPIO,,,COLISÃO LATERAL,0,1,0,0,0,0,0,0,0,1,0,,,,,,,,,,,,,
2023-08-05,sábado ,11:59:00,COM VÍTIMA,MADALENA,RUA,RUA COMENDADOR BENTO AGUIAR,,,AO LADO DO ANTIGO EXTRA DA BENFICA NA FRENTE DA MICROOFICE,MADALENA,,,COLISÃO LATERAL,0,1,0,0,0,0,0,0,0,1,0,,,,,,,,,,,,,
2023-08-05,sábado ,11:59:00,COM VÍTIMA,CORDEIRO,AVENIDA,AVENIDA CAXANGA,,,PX A REPUBLICA DO PAO PADARIA E RESTORUARANTE EXPOSIÇAO DE ANIMAIS,CORDEIRO,,,COLISÃO LATERAL,0,1,0,0,0,0,0,0,0,1,0,,,,,,,,,,,,,
2023-08-05,sábado ,12:53:00,COM VÍTIMA,BEBERIBE,AVENIDA,AVENIDA BEBERIBE,,,E/F A ELETRO  EO POSTO DE GASOILINA,BEBERIBE,,,COLISÃO LATERAL,0,0,0,0,0,0,0,0,0,1,0,,,,,,,,,,,,,
2023-08-05,sábado ,03:43:00,COM VÍTIMA,CAMPO GRANDE,RUA,RUA FRANKLIN TAVORA,,,APOS A PADARIA SANTO ANTONIO E O MERCADO SITIO NOVO,CAMPO GRANDE,,,COLISÃO LATERAL,0,0,0,0,0,0,0,0,0,1,0,,,,,,,,,,,,,
2023-08-05,sábado ,06:16:00,COM VÍTIMA,TORRE,RUA,RUA JOSE BONIFACIO,,,EM CIMA DO VIADUTO AO LADO DO CARREFUR DA TORRE,TORRE,,,COLISÃO LATERAL,0,0,0,0,0,0,0,0,0,1,0,,,,,,,,,,,,,
2023-08-05,sábado ,06:39:00,COM VÍTIMA,BOA VIAGEM,RUA,RUA DES JOAO PAES,RUA,RUA CORONEL ANIZIO RODRIGUES COELHO,,BOA VIAGEM,,,COLISÃO FRONTAL,0,0,0,0,0,0,0,0,0,1,0,,,,,,,,,,,,,
2023-08-06,domingo ,07:53:00,COM VÍTIMA,BOA VIAGEM,RUA,RUA RIBEIRO DE BRITO,,,EM CIMA DO VIADUTO TANCREDO NEVES,BOA VIAGEM,,,COLISÃO FRONTAL,0,1,0,0,0,0,0,0,0,1,0,,,,,,,,,,,,,
2023-08-06,domingo ,08:22:00,COM VÍTIMA,TORRE,RUA,RUA CONDE DE IRAJA,AVENIDA,AVENIDA BEIRA RIO,DESCIDA DA PONTE DA TORRE,TORRE,,,COLISÃO LATERAL,2,0,0,0,0,0,0,0,0,1,0,,,,,,,,,,,,,
2023-08-06,domingo ,09:34:00,COM VÍTIMA,VARZEA,RUA,RUA FRANCISCO TORRES,,,EM FRENTE A PRAÇA NOVA MORADA,VARZEA,,,COLISÃO FRONTAL,0,1,0,0,0,0,0,0,0,1,0,,,,,,,,,,,,,
2023-08-06,domingo ,12:54:00,SEM VÍTIMA,JARDIM SAO PAULO,AVENIDA,AVENIDA RECIFE,,,AO LADO DO ASSAI / SENTIDO BOA VIAGEM,JARDIM SAO PAULO,705,,COLISÃO TRASEIRA,2,0,0,0,0,0,0,1,0,0,0,,,,,,,,,,,,,
2023-08-06,domingo ,03:03:00,COM VÍTIMA,COHAB,AVENIDA,AVENIDA SAO PAULO,,,TERMINAL DE ÔNIBUS DE TRÊS CARNEIROS,COHAB,,,TOMBAMENTO,0,0,0,0,0,0,0,0,0,1,0,,,,,,,,,,,,,
2023-08-06,domingo ,06:06:00,SEM VÍTIMA,ESTANCIA,AVENIDA,AVENIDA DR JOSE RUFINO,,,IGREJA SANTA LUZIA / MAXIMUS SUPLEMENTOS,ESTANCIA,,,COLISÃO FRONTAL,2,0,0,0,0,0,0,0,0,0,0,,,,,,,,,,,,,
2023-08-06,domingo ,07:10:00,COM VÍTIMA,COQUEIRAL,RUA,RUA LINHA NOVA,,,PROXIMO A ESTAÇÃO CONQUEIRAL,COQUEIRAL,,,COLISÃO FRONTAL,1,1,0,0,0,0,0,0,0,1,0,,,,,,,,,,,,,
2023-08-06,domingo ,09:50:00,COM VÍTIMA,PINA,AVENIDA,AVENIDA ENGENHEIRO DOMINGOS FERREIRA,,,PRÓXIMO À MEDICAL CENTER,PINA,,,COLISÃO LATERAL,1,1,0,0,0,0,0,0,0,1,0,,,,,,,,,,,,,
2023-08-06,domingo ,10:29:00,COM VÍTIMA,BOMBA DO HEMETERIO,RUA,RUA BOMBA DO HEMETERIO,,,PRÍXIMO À SEDE DO CLUBE ABANADORES DO ARRUDA,BOMBA DO HEMETERIO,,,COLISÃO LATERAL,1,1,0,0,0,0,0,0,0,1,0,,,,,,,,,,,,,
2023-08-06,domingo ,11:38:00,COM VÍTIMA,IBURA,RUA,RUA BARÃO DE TIMBAÚBA,,,RUA BARÃO DE TIMBAÚBA (NÃO CADASTRADA NA PLANILHA) ENTRANDO NA TERCEIRA RUA, APÓS O POSTO POLICIAL DA AV DOM HELDER CÂMARA,IBURA,,,COLISÃO LATERAL,1,1,0,0,0,0,0,0,0,1,0,,,,,,,,,,,,
2023-08-07,segunda-feira ,07:03:00,COM VÍTIMA,CASA AMARELA,AVENIDA,AVENIDA NORTE MIGUEL ARRAES DE ALENCAR,,,NA ENTRADA DA MANGABEIRA SENTIDO CIDADE,CASA AMARELA,,,COLISÃO LATERAL,0,1,0,0,0,0,0,0,0,1,0,,,,,,,,,,,,,
2023-08-07,segunda-feira ,07:45:00,COM VÍTIMA,JARDIM SAO PAULO,AVENIDA,AVENIDA LIBERDADE,,,EM FRENTE AO COND VILA JARDIM E A VIDRAÇARIA,JARDIM SAO PAULO,,,COLISÃO TRANSVERSAL,0,1,0,0,0,0,0,0,0,1,0,,,,,,,,,,,,,
2023-08-07,segunda-feira ,08:47:00,COM VÍTIMA,BOA VIAGEM,AVENIDA,AVENIDA BOA VIAGEM,,,HA 500 METROS DO HOSPITAL DA AERONAUTICA,BOA VIAGEM,,,COLISÃO TRASEIRA,1,1,0,0,0,0,0,0,0,1,0,,,,,,,,,,,,,
2023-08-07,segunda-feira ,10:37:00,COM VÍTIMA,IMBIRIBEIRA,AVENIDA,AVENIDA MARECHAL MASCARENHAS DE MORAES,,,EM FRENTE A FACULDADE,IMBIRIBEIRA,,,ATROPELAMENTO DE PESSOA,1,0,0,0,1,0,0,0,0,1,0,,,,,,,,,,,,,
2023-08-07,segunda-feira ,11:54:00,COM VÍTIMA,IBURA,AVENIDA,AVENIDA DOIS RIOS,,,LABORATORIO GILSOM CIDRIM,IBURA,,,COLISÃO LATERAL,1,1,0,0,0,0,0,0,0,1,0,,,,,,,,,,,,,
2023-08-07,segunda-feira ,06:27:00,COM VÍTIMA,LINHA DO TIRO,RUA,RUA SANTA MERCEDES,,,NA SUBIDA DA GONZAGA RECEPÇÕES, PX AO N144,LINHA DO TIRO,,,COLISÃO FRONTAL,0,1,0,0,0,0,0,0,0,1,0,,,,,,,,,,,,
2023-08-07,segunda-feira ,06:42:00,COM VÍTIMA,IPSEP,RUA,RUA PROFESSOR JOSE VICENTE,,,NA RUA DO CANAL PROX AO MERCADINHO CONVENÇÃO,IPSEP,,,COLISÃO FRONTAL,0,1,0,0,0,0,0,0,0,1,0,,,,,,,,,,,,,
2023-08-07,segunda-feira ,08:33:00,COM VÍTIMA,IPUTINGA,AVENIDA,AVENIDA MAURICIO DE NASSAU,EST,EST DO BARBALHO,,IPUTINGA,246,,COLISÃO LATERAL,0,1,0,1,0,0,0,0,0,1,0,,,,,,,,,,,,,
2023-08-08,terça-feira ,07:21:00,COM VÍTIMA,SAN MARTIN,AVENIDA,AVENIDA GENERAL SAN MARTIN,,,PROX A CAVALARIA // NA LOMBADA ELETRONICA,SAN MARTIN,,,COLISÃO LATERAL,0,1,0,0,0,0,0,0,0,1,0,,,,,,,,,,,,,
2023-08-08,terça-feira ,07:37:00,COM VÍTIMA,BOA VIAGEM,AVENIDA,AVENIDA CELSO FURTADO (VIA MANGUE),,,,BOA VIAGEM,,,COLISÃO TRASEIRA,0,0,0,0,0,0,0,0,0,1,0,,,,,,,,,,,,,
2023-08-08,terça-feira ,07:43:00,COM VÍTIMA,CASA FORTE,RUA,RUA LEONARDO BEZERRA CAVALCANTE,,,HOSPITAL MARIA LUCINDA // PET SHOOP,CASA FORTE,,,COLISÃO LATERAL,1,1,0,0,0,0,0,0,0,1,0,,,,,,,,,,,,,
2023-08-08,terça-feira ,07:55:00,COM VÍTIMA,SAN MARTIN,AVENIDA,AVENIDA GENERAL SAN MARTIN,,,PROXIMO A CAVALARIA,SAN MARTIN,,,COLISÃO LATERAL,0,1,0,0,0,0,0,0,0,1,0,,,,,,,,,,,,,
2023-08-08,terça-feira ,08:00:00,COM VÍTIMA,IBURA,AVENIDA,AVENIDA DOIS RIOS,,,PROXIMO A FARMACIA DIARIAMENTE E PROX A FARMACIA IDEPENDENTE,IBURA,,,COLISÃO LATERAL,0,1,0,0,0,0,0,0,0,1,0,,,,,,,,,,,,,
2023-08-08,terça-feira ,08:15:00,COM VÍTIMA,PINA,AVENIDA,AVENIDA ENGENHEIRO DOMINGOS FERREIRA,,,PROX AO MULTI POSTO / E AO HOTEL IBIS,PINA,,,COLISÃO LATERAL,1,1,0,0,0,0,0,0,0,1,0,,,,,,,,,,,,,
2023-08-08,terça-feira ,10:07:00,COM VÍTIMA,BAIRRO DO RECIFE,AVENIDA,AVENIDA BARBOSA LIMA,,,PROX AO SOF PET,BAIRRO DO RECIFE,,,COLISÃO LATERAL,0,1,0,0,0,0,0,0,0,1,0,,,,,,,,,,,,,
2023-08-08,terça-feira ,10:06:00,COM VÍTIMA,SAN MARTIN,AVENIDA,AVENIDA JOAO CABRAL DE MELO NETO,RUA,RUA TENENTE MINDELO,,SAN MARTIN,250,,COLISÃO LATERAL,0,2,0,0,0,0,0,0,0,1,0,,,,,,,,,,,,,
2023-08-08,terça-feira ,03:01:00,COM VÍTIMA,BEBERIBE,AVENIDA,AVENIDA BEBERIBE,,,EM FRENTE A FERREIRA PINTO,BEBERIBE,,,COLISÃO LATERAL,0,1,0,0,0,0,0,0,0,1,0,,,,,,,,,,,,,
2023-08-08,terça-feira ,04:20:00,COM VÍTIMA,BOA VISTA,RUA,RUA DA AURORA,RUA,RUA PRINCESA IZABEL,,BOA VISTA,,,COLISÃO TRASEIRA,0,2,0,0,0,0,0,0,0,1,0,,,,,,,,,,,,,
2023-08-08,terça-feira ,04:32:00,COM VÍTIMA,IBURA,AVENIDA,AVENIDA DOIS RIOS,,,PROX AO SESI E A CLINICA ODONTO MEDIC,IBURA,,,COLISÃO LATERAL,0,1,0,0,0,0,0,0,0,1,0,,,,,,,,,,,,,
2023-08-08,terça-feira ,04:33:00,COM VÍTIMA,SAO JOSE,RUA,RUA IMPERADOR PEDRO SEGUNDO,,,PROX A LOJA FERRO E AÇO,SAO JOSE,,,COLISÃO LATERAL,0,1,0,0,0,0,0,0,0,1,0,,,,,,,,,,,,,
2023-08-08,terça-feira ,04:38:00,COM VÍTIMA,SAO JOSE,RUA,RUA IMPERIAL,,,PRÓXIMO A JUCEPE,SAO JOSE,510,,COLISÃO LATERAL,0,1,0,0,0,0,1,0,0,1,0,,,,,,,,,,,,,
2023-08-08,terça-feira ,04:51:00,COM VÍTIMA,BOA VIAGEM,AVENIDA,AVENIDA DOM JOAO VI,RUA,RUA PEDRO PAES DE MENDONCA,PROX  AO BIG BOMPREÇO  FECHADO  E PROX AO NUMERO 200,BOA VIAGEM,,,COLISÃO LATERAL,1,1,0,0,0,0,0,0,0,1,0,,,,,,,,,,,,,
2023-08-08,terça-feira ,06:10:00,COM VÍTIMA,GRACAS,RUA,RUA AMELIA,,,EM FRENTE AO COLEGIO AGNES E A FARMACIA DROGASIL,GRACAS,,,COLISÃO LATERAL,0,1,0,0,0,0,0,0,0,1,0,,,,,,,,,,,,,
2023-08-08,terça-feira ,06:48:00,COM VÍTIMA,IPSEP,AVENIDA,AVENIDA RECIFE,,,EM FRENTE AO POSTO BR,IPSEP,393,,COLISÃO TRASEIRA,0,2,0,0,0,0,0,0,0,1,0,,,,,,,,,,,,,
2023-08-08,terça-feira ,08:52:00,COM VÍTIMA,BOA VIAGEM,RUA,RUA FELIX DE BRITO E MELO,,,EM FRENTA A FARMACIA DEPENDENDE, PROXIMO AO CARRIFOUR,BOA VIAGEM,,,COLISÃO FRONTAL,1,1,0,0,0,0,0,0,0,1,0,,,,,,,,,,,,
2023-08-08,terça-feira ,10:49:00,COM VÍTIMA,TORROES,RUA,RUA IRANI,RUA,RUA ZUMBI DOS PALMARES,E/F AO MERCADINHO BEZERRA - AO LADO DA IGREJA BATISTA,TORROES,,,COLISÃO LATERAL,1,1,0,0,0,0,0,0,0,1,0,,,,,,,,,,,,,
2023-08-09,quarta-feira ,06:36:00,COM VÍTIMA,MACAXEIRA,AVENIDA,AVENIDA NORTE MIGUEL ARRAES DE ALENCAR,,,INTEGRAÇÃO DA MACAXEIRA,MACAXEIRA,,,ATROPELAMENTO DE PESSOA,0,0,0,0,0,1,0,0,0,1,0,,,,,,,,,,,,,
2023-08-09,quarta-feira ,07:23:00,COM VÍTIMA,VARZEA,AVENIDA,AVENIDA AFONSO OLINDENSE,,,PROX A LOMBADA ELETRONICA EM FRENTE A ACADEMIA GREEN ATENDIDO PELA BASICA 17 RECIFE(ARLIENE),VARZEA,,,COLISÃO LATERAL,1,1,0,0,0,0,0,0,0,1,0,,,,,,,,,,,,,
2023-08-09,quarta-feira ,07:25:00,COM VÍTIMA,BONGI,AVENIDA,AVENIDA ENGENHEIRO ABDIAS DE CARVALHO,,,EM FRENTE AO NOVO ATACAREJO,BONGI,,CIDADE,COLISÃO LATERAL,0,1,0,0,0,0,0,0,0,1,0,,,,,,,,,,,,,
2023-08-09,quarta-feira ,07:39:00,COM VÍTIMA,IPUTINGA,AVENIDA,AVENIDA MARIO ALVARES PEREIRA DE LYRA,,,PROX AO CANAL DO CAVOCO / PROX A ACADEMIA DA CIDADE,IPUTINGA,,,COLISÃO LATERAL,1,1,0,0,0,0,0,0,0,1,0,,,,,,,,,,,,,
2023-08-09,quarta-feira ,08:33:00,COM VÍTIMA,AREIAS,AVENIDA,AVENIDA DR JOSE RUFINO,,,EM FRENTE A HONDA,AREIAS,,,COLISÃO LATERAL,0,1,0,0,0,0,0,0,0,1,0,,,,,,,,,,,,,
2023-08-09,quarta-feira ,10:55:00,SEM VÍTIMA,PINA,AVENIDA,AVENIDA REPUBLICA DO LIBANO,RUA,RUA NOGUEIRA DE SOUZA,,PINA,,,COLISÃO FRONTAL,1,0,0,0,0,0,1,0,0,0,0,,,,,,,,,,,,,
2023-08-09,quarta-feira ,12:32:00,COM VÍTIMA,SANTO AMARO,AVENIDA,AVENIDA DR JAYME DA FONTE,,,PROX A COMPESA / AO LADO LOJA RAIO BIKE,SANTO AMARO,,,ATROPELAMENTO DE PESSOA,1,0,0,0,1,0,0,0,0,1,0,,,,,,,,,,,,,
2023-08-09,quarta-feira ,12:52:00,COM VÍTIMA,ARRUDA,RUA,RUA DO MACHADO,,,PROX AO ESPERTINHO DO BIO / EM FRENTE IMPORIO DA CERVEJA,ARRUDA,,,COLISÃO FRONTAL,0,1,0,0,0,0,0,0,0,1,0,,,,,,,,,,,,,
2023-08-09,quarta-feira ,02:01:00,COM VÍTIMA,AFOGADOS,RUA,RUA SAO MIGUEL,,,E/F A  DISTRIBUIDORA RENASCER,AFOGADOS,,,COLISÃO LATERAL,1,1,0,0,0,0,0,0,0,1,0,,,,,,,,,,,,,
2023-08-09,quarta-feira ,02:39:00,COM VÍTIMA,BOA VIAGEM,RUA,RUA JOAO DIAS MARTINS,,,PROIX AO EDIFICIO MIRELAE AO FRATELLI TURISMO,BOA VIAGEM,,,COLISÃO LATERAL,0,1,0,0,0,0,0,0,0,1,0,,,,,,,,,,,,,
2023-08-09,quarta-feira ,07:09:00,COM VÍTIMA,CABANGA,VIADUTO,VIADUTO CAPITAO TEMUDO,,,SOBRE O VIADUTO,CABANGA,,,COLISÃO TRASEIRA,0,0,0,0,0,0,0,0,0,1,0,,,,,,,,,,,,,
2023-08-09,quarta-feira ,07:16:00,COM VÍTIMA,CORDEIRO,AVENIDA,AVENIDA INACIO MONTEIRO,,,ASSEMBLEIA DE DEUS,CORDEIRO,,,COLISÃO LATERAL,1,1,0,0,0,0,0,0,0,1,0,,,,,,,,,,,,,
2023-08-09,quarta-feira ,07:33:00,COM VÍTIMA,ILHA DO LEITE,RUA,RUA FRANCISCO ALVES,,,ESQUINA COM HOSPITAL ESPERANÇA,ILHA DO LEITE,,,COLISÃO FRONTAL,1,1,0,0,0,0,0,0,0,1,0,,,,,,,,,,,,,
2023-08-10,quinta-feira ,09:58:00,SEM VÍTIMA,SANTO AMARO,AVENIDA,AVENIDA GOVERNADOR AGAMENON MAGALHAES,,,PRÓXIMO A REITORIA,SANTO AMARO,,,COLISÃO LATERAL,1,0,0,0,0,0,0,1,0,0,0,,,,,,,,,,,,,
2023-08-10,quinta-feira ,10:02:00,COM VÍTIMA,SANTO ANTONIO,RUA,RUA FLORIANO PEIXOTO,,,AO LADO DA CASA DA CULTURA,SANTO ANTONIO,,,COLISÃO FRONTAL,0,1,0,0,0,0,0,0,0,1,0,,,,,,,,,,,,,
2023-08-10,quinta-feira ,11:23:00,COM VÍTIMA,TORRE,RUA,RUA REAL DA TORRE,,,EM FRENTE A ESCOLA DESPERTAR,TORRE,,,COLISÃO LATERAL,1,1,0,0,0,0,0,0,0,1,0,,,,,,,,,,,,,
2023-08-10,quinta-feira ,01:26:00,SEM VÍTIMA,CASA AMARELA,AVENIDA,AVENIDA NORTE MIGUEL ARRAES DE ALENCAR,,,ACADEMIA DA SAÚDE,CASA AMARELA,,,COLISÃO LATERAL,0,0,0,0,0,0,1,1,0,0,0,,,,,,,,,,,,,
2023-08-10,quinta-feira ,04:08:00,COM VÍTIMA,TORROES,AVENIDA,AVENIDA ENGENHEIRO ABDIAS DE CARVALHO,,,RETIFICA SÃO PEDRO,TORROES,,,COLISÃO LATERAL,1,2,0,0,0,0,0,0,0,2,0,,,,,,,,,,,,,
2023-08-10,quinta-feira ,06:03:00,COM VÍTIMA,IMBIRIBEIRA,AVENIDA,AVENIDA MARECHAL MASCARENHAS DE MORAES,,,EM FRENTE A FOCUS LOCADORA DE VEICULOS E PROX AO AEROPORTO,IMBIRIBEIRA,,,COLISÃO LATERAL,0,1,0,0,0,0,0,0,0,1,0,,,,,,,,,,,,,
2023-08-10,quinta-feira ,08:02:00,COM VÍTIMA,AREIAS,AVENIDA,AVENIDA DR JOSE RUFINO,,,PRÓXIMO À FARMÁCIA DROGASIL E POSTO SHELL,AREIAS,,,COLISÃO LATERAL,0,1,0,0,0,0,0,0,0,1,0,,,,,,,,,,,,,
2023-08-10,quinta-feira ,08:31:00,COM VÍTIMA,ZUMBI,RUA,RUA TOMAZ GONZAGA,,,PROXIMO AO EDF TEMER,ZUMBI,,,COLISÃO LATERAL,0,1,0,0,0,0,0,0,0,1,0,,,,,,,,,,,,,
2023-08-11,sexta-feira ,03:59:00,SEM VÍTIMA,MADALENA,RUA,RUA MENEZES DRUMOND,,,PROSSIMO DA PRAÇA DA MADALENA,MADALENA,,,COLISÃO TRASEIRA,3,0,0,0,0,0,0,1,0,0,0,,,,,,,,,,,,,
2023-08-11,sexta-feira ,07:55:00,COM VÍTIMA,IBURA,RUA,RUA DR BENIGNO JORDAO DE VASCONCELOS,,,PROX A UPA DE LAGOA ENCANTADA IBURA DE CIMA,IBURA,,,COLISÃO FRONTAL,0,1,0,0,0,0,0,0,0,1,0,,,,,,,,,,,,,
2023-08-11,sexta-feira ,07:59:00,SEM VÍTIMA,AREIAS,AVENIDA,AVENIDA RECIFE,,,PROX A LOJA ARMAZEM CORAL / NA DESCINDA DO VIATUDO DA ESTAÇÃO SANTA LUZIA, PROX AO SUPERMERCADO ATACADÃO,AREIAS,,SUBURBIO,COLISÃO LATERAL,1,0,0,0,0,0,1,0,0,0,0,,,,,,,,,,,,
2023-08-11,sexta-feira ,10:45:00,COM VÍTIMA,MORRO DA CONCEICAO,RUA,RUA ITACOATIARA,,,SUB DO MORRO DA CONCEIÇÃO / EM FRENTE AO CALDO DE CANA,MORRO DA CONCEICAO,,,COLISÃO FRONTAL,0,1,0,0,0,0,0,0,0,1,0,,,,,,,,,,,,,
2023-08-11,sexta-feira ,10:55:00,COM VÍTIMA,MADALENA,RUA,RUA REAL DA TORRE,,,PROX AO POSTO SETA / ANTES DO MERCADO DA MADALENA,MADALENA,,,COLISÃO LATERAL,0,1,0,0,0,0,0,0,0,1,0,,,,,,,,,,,,,
2023-08-11,sexta-feira ,12:11:00,COM VÍTIMA,BOMBA DO HEMETERIO,RUA,RUA BOMBA DO HEMETERIO,,,PROX AO CONSULTORIO MEDICO /  E FUNERARIA CANAA,BOMBA DO HEMETERIO,,,COLISÃO LATERAL,0,1,0,0,0,0,0,0,0,1,0,,,,,,,,,,,,,
2023-08-11,sexta-feira ,12:44:00,COM VÍTIMA,CABANGA,AVENIDA,AVENIDA ENGENHEIRO JOSE ESTELITA,,,EM FRENTE A MOURA B / NO CAIS DO ESTELITA AO LADO DO CABANGA,CABANGA,,,COLISÃO LATERAL,1,0,0,0,0,0,0,0,0,1,0,,,,,,,,,,,,,
2023-08-11,sexta-feira ,02:32:00,COM VÍTIMA,AFOGADOS,RUA,RUA SAO MIGUEL,,,PROX A MATERNIDADE BANDEIRA FILHO E AO POSTO DE GASOLINA DISLURB,AFOGADOS,,,COLISÃO LATERAL,0,1,0,0,0,0,0,0,0,1,0,,,,,,,,,,,,,
2023-08-11,sexta-feira ,02:54:00,COM VÍTIMA,IMBIRIBEIRA,AVENIDA,AVENIDA GENERAL MAC ARTHUR,,,EM FRENTE AO POSTO BR APOS O LE PARQUE,IMBIRIBEIRA,,,COLISÃO LATERAL,1,0,0,0,0,0,0,0,0,1,0,,,,,,,,,,,,,
2023-08-11,sexta-feira ,05:05:00,COM VÍTIMA,IMBIRIBEIRA,RUA,RUA ARQUITETO LUIZ NUNES,,,SEMÁFORO 635,IMBIRIBEIRA,,,COLISÃO LATERAL,0,1,0,0,0,0,1,0,0,1,0,,,,,,,,,,,,,
