data,dia_semana,hora,natureza,bairro,logradouro_endereco,endereco,logradouro_detalhe_endereço,detalhe_endereco_acidente,complemento,bairro_cruzamento,num_semaforo,sentido_via,tipo,auto,moto,ciclom,ciclista,pedestre,onibus,caminhao,viatura,outros,vitimas,vitimasfatais,acidente_verificado,tempo_clima,situacao_semaforo,sinalizacao,condicao_via,conservacao_via,ponto_controle,situacao_placa,velocidade_max_via,mao_direcao,divisao_via1,divisao_via2,divisao_via3
2023-10-18,quarta-feira ,02:53:00,COM VÍTIMA,COHAB,AVENIDA,AVENIDA SANTOS,,,UR2 / EM FRENTE AO FERRO VELHO MOZÁ,COHAB,,,COLISÃO,0,0,0,0,0,0,0,0,0,1,0,,,,,,,,,,,,,
2023-10-18,quarta-feira ,03:39:00,COM VÍTIMA,ESTANCIA,AVENIDA,AVENIDA RECIFE,,,PROXIMO O GALETOS E AO RESIDENCIAL IGNEZ ANDREAZZA,ESTANCIA,,,COLISÃO,0,1,0,0,0,0,0,0,0,1,0,,,,,,,,,,,,,
2023-10-18,quarta-feira ,04:08:00,COM VÍTIMA,PRADO,RUA,RUA HERCULES FLORENCE,,,PROX A BIG CAR,PRADO,,,COLISÃO LATERAL,1,1,0,0,0,0,0,0,0,1,0,,,,,,,,,,,,,
2023-10-18,quarta-feira ,04:20:00,SEM VÍTIMA,IPSEP,RUA,RUA SAO NICOLAU,RUA,RUA ABDIAS CABRAL DE MOURA,EM FRENTE A SPORT CAR,IPSEP,,,,1,0,0,0,0,0,0,0,0,0,0,,,,,,,,,,,,,
2023-10-18,quarta-feira ,05:11:00,COM VÍTIMA,COHAB,RUA,RUA DR BENIGNO JORDAO DE VASCONCELOS,,,PROXIMO A ESCOLA LAGOA ENCANTADA E AO SALÃO DE BELEZA SAMANTA MOURA,COHAB,,,COLISÃO,0,1,0,0,0,0,0,0,0,1,0,,,,,,,,,,,,,
2023-10-18,quarta-feira ,05:59:00,COM VÍTIMA,SANTO AMARO,AVENIDA,AVENIDA CRUZ CABUGA,,,PROXIMO AO PARQUE TREZE DE MAIO E CAIXA ECONOMICA,SANTO AMARO,,,COLISÃO,0,1,0,0,0,0,0,0,0,1,0,,,,,,,,,,,,,
2023-10-18,quarta-feira ,07:43:00,COM VÍTIMA,IBURA,AVENIDA,AVENIDA DOM HELDER CAMARA,,,CRUZAMENTO DA LINHA FÉRREA,IBURA,,,COLISÃO,0,1,0,1,0,0,0,0,0,1,0,,,,,,,,,,,,,
2023-10-19,quinta-feira ,12:17:00,COM VÍTIMA,BOA VIAGEM,RUA,RUA VISCONDE DE JEQUITINHONHA,RUA,RUA ERNESTO DE PAULA SANTOS,SUPER MERCADO SOBERANO,BOA VIAGEM,304,,COLISÃO,0,0,0,0,0,0,0,0,0,1,0,,,,,,,,,,,,,
2023-10-19,quinta-feira ,07:43:00,COM VÍTIMA,ARRUDA,AVENIDA,AVENIDA PROFESSOR JOSE DOS ANJOS,,,EM FRENTE A COOPERATIVA PALHA DE ARROZ,ARRUDA,,,COLISÃO LATERAL,0,1,0,0,0,0,0,0,0,1,0,,,,,,,,,,,,,
2023-10-19,quinta-feira ,09:12:00,COM VÍTIMA,SANTO AMARO,AVENIDA,AVENIDA CRUZ CABUGA,,,PROX. AO MINISTERIO MADUREIRA, ANTIGA HONDA E CASA FUNERARIA MORADA DA PAZ,SANTO AMARO,,,COLISÃO LATERAL,1,1,0,0,0,1,0,0,0,2,0,,,,,,,,,,,,
2023-10-19,quinta-feira ,10:27:00,COM VÍTIMA,AREIAS,AVENIDA,AVENIDA DR JOSE RUFINO,,,AO LADO DO SENAI, PACIENTE DENTRO DA ACADEMIA GRIBLOX,AREIAS,,,COLISÃO LATERAL,0,1,0,0,0,0,0,0,0,1,0,,,,,,,,,,,,
2023-10-19,quinta-feira ,10:27:00,COM VÍTIMA,TORROES,RUA,RUA WASHINGTON DUARTE ESPINDOLA,,,VIA QUE LIGA A AV. RECIFE A BR-101,TORROES,0,,ATROPELAMENTO DE PESSOA,0,0,0,0,1,1,0,0,0,1,0,,,,,,,,,,,,,
2023-10-19,quinta-feira ,11:57:00,COM VÍTIMA,BOA VIAGEM,RUA,RUA MAMANGUAPE,,,PROX. AO CARREFOUR,BOA VIAGEM,,,COLISÃO COM CICLISTA,1,0,0,1,0,0,0,0,0,1,0,,,,,,,,,,,,,
2023-10-19,quinta-feira ,02:02:00,COM VÍTIMA,JARDIM SAO PAULO,AVENIDA,AVENIDA RECIFE,,,DENTRO DO SUPEMERCADO ASSAI,JARDIM SAO PAULO,,,COLISÃO TRANSVERSAL,1,1,0,0,0,0,0,0,0,1,0,,,,,,,,,,,,,
2023-10-19,quinta-feira ,02:42:00,COM VÍTIMA,ESPINHEIRO,RUA,RUA DO ESPINHEIRO,,,PROXIMO AO RESTAURANTE VIA PALADAR E A FARMACIA DROGASIL,ESPINHEIRO,,,COLISÃO,0,1,0,0,0,0,0,0,0,1,0,,,,,,,,,,,,,
2023-10-19,quinta-feira ,07:20:00,COM VÍTIMA,SANTO AMARO,PRC,PRC GENERAL ABREU E LIMA,,,POR TRÁS DA ESCOLA ALMIRANTE SOARES DULTRA,SANTO AMARO,,,ATROPELAMENTO DE ANIMAL,0,1,0,0,0,0,0,0,0,1,0,,,,,,,,,,,,,
2023-10-20,sexta-feira ,12:42:00,COM VÍTIMA,SANTO AMARO,AVENIDA,AVENIDA NORTE MIGUEL ARRAES DE ALENCAR,AVENIDA,AVENIDA CRUZ CABUGA,CEMITERIO DOS INGLESES,SANTO AMARO,,,COLISÃO TRANSVERSAL,2,0,0,0,0,0,0,0,0,3,0,,,,,,,,,,,,,
2023-10-20,sexta-feira ,06:47:00,COM VÍTIMA,PINA,AVENIDA,AVENIDA ANTONIO DE GOES,,,PROX. AO SHOPPING RIO MAR E COMPESA,PINA,,,COLISÃO LATERAL,0,1,0,0,0,0,0,0,0,1,0,,,,,,,,,,,,,
2023-10-20,sexta-feira ,07:40:00,COM VÍTIMA,SANTO AMARO,AVENIDA,AVENIDA DR JAYME DA FONTE,,,PROX. AO SUPERMERCADO MAIS VOCE E ELAINE MODAS,SANTO AMARO,,,COLISÃO LATERAL,0,1,0,0,0,0,0,0,0,1,0,,,,,,,,,,,,,
2023-10-20,sexta-feira ,10:19:00,COM VÍTIMA,BOA VIAGEM,AVENIDA,AVENIDA ENGENHEIRO DOMINGOS FERREIRA,,,EM FRENTE AO RESTAURANTE FAMILIA JULIANO,BOA VIAGEM,,,COLISÃO,0,1,0,0,0,0,0,0,0,1,0,,,,,,,,,,,,,
2023-10-20,sexta-feira ,10:30:00,COM VÍTIMA,AREIAS,AVENIDA,AVENIDA RECIFE,,,PROX AO POSTO SHELL, SENTIDO SAN MARTIN  ( DEPOIS DO ATACADAO ),AREIAS,,,ATROPELAMENTO DE PESSOA,0,1,0,0,1,0,0,0,0,1,0,,,,,,,,,,,,
2023-10-20,sexta-feira ,10:39:00,COM VÍTIMA,BOA VIAGEM,AVENIDA,AVENIDA ENGENHEIRO DOMINGOS FERREIRA,,,EM FRENTE AO ASSAI,BOA VIAGEM,380,,COLISÃO TRASEIRA,0,2,0,0,0,1,0,0,0,1,0,,,,,,,,,,,,,
2023-10-20,sexta-feira ,01:07:00,COM VÍTIMA,IMBIRIBEIRA,AVENIDA,AVENIDA MARECHAL MASCARENHAS DE MORAES,,,LADO OPOSTO A GRILO/ SENTIDO AEROPORTO,IMBIRIBEIRA,396,,COLISÃO LATERAL,3,0,0,0,0,0,0,0,0,1,0,,,,,,,,,,,,,
2023-10-20,sexta-feira ,01:30:00,COM VÍTIMA,BEBERIBE,AVENIDA,AVENIDA BEBERIBE,AVENIDA,AVENIDA PROFESSOR JOSE DOS ANJOS,,BEBERIBE,,,COLISÃO COM CICLISTA,1,0,0,2,0,0,0,0,0,1,0,,,,,,,,,,,,,
2023-10-20,sexta-feira ,01:43:00,COM VÍTIMA,JORDAO,AVENIDA,AVENIDA MARIA IRENE,,,BASE AEREA DE RECIFE,JORDAO,,,COLISÃO LATERAL,0,0,0,0,0,0,0,0,0,1,0,,,,,,,,,,,,,
2023-10-20,sexta-feira ,02:45:00,COM VÍTIMA,BOA VISTA,AVENIDA,AVENIDA CONDE DA BOA VISTA,,,PROXIMO AO SHOPPING BOA VISTA E DROGARIA SÃO PAULO,BOA VISTA,,,COLISÃO,0,1,0,0,0,2,0,0,0,1,0,,,,,,,,,,,,,
2023-10-20,sexta-feira ,02:49:00,COM VÍTIMA,AFOGADOS,RUA,RUA PADRE JOSE DE SA LEITAO,AVENIDA,AVENIDA SUL,,AFOGADOS,509,,COLISÃO,1,0,0,0,1,0,0,0,0,1,0,,,,,,,,,,,,,
2023-10-20,sexta-feira ,03:06:00,COM VÍTIMA,IMBIRIBEIRA,AVENIDA,AVENIDA PINHEIROS,AVENIDA,AVENIDA MARECHAL MASCARENHAS DE MORAES,,IMBIRIBEIRA,,,COLISÃO,1,1,0,0,0,0,0,0,0,1,0,,,,,,,,,,,,,
2023-10-20,sexta-feira ,03:59:00,COM VÍTIMA,ALTO JOSE DO PINHO,RUA,RUA MARAGOGI,,,E/F A IGRJA UNIVERSAL,ALTO JOSE DO PINHO,,,COLISÃO FRONTAL,0,2,0,0,0,0,0,0,0,1,0,,,,,,,,,,,,,
2023-10-20,sexta-feira ,05:57:00,COM VÍTIMA,CAMPO GRANDE,RUA,RUA JERONIMO VILELA,,,PROXIMO A PADARIA SANTO ANTONIO,CAMPO GRANDE,,,COLISÃO,0,1,0,0,0,0,0,0,0,1,0,,,,,,,,,,,,,
2023-10-20,sexta-feira ,06:58:00,COM VÍTIMA,IMBIRIBEIRA,AVENIDA,AVENIDA MARECHAL MASCARENHAS DE MORAES,,,JUIZADO ESPECIAIS DO RECIFE / POSTO DE SAUDE,IMBIRIBEIRA,,,QUEDA,0,1,0,0,0,0,0,0,0,1,0,,,,,,,,,,,,,
2023-10-20,sexta-feira ,08:12:00,COM VÍTIMA,JOANA BEZERRA,VIADUTO,VIADUTO CAPITAO TEMUDO,,,SUBIDA DO VIADUTO,JOANA BEZERRA,,,COLISÃO,0,2,0,0,0,1,0,0,0,1,0,,,,,,,,,,,,,
2023-10-20,sexta-feira ,11:14:00,COM VÍTIMA,CASA AMARELA,EST,EST DO ARRAIAL,RUA,RUA PAULA BATISTA,AGENCIA NACIONAL DE MINERAÇÃO,CASA AMARELA,,,COLISÃO,1,1,0,0,0,0,0,0,0,1,0,,,,,,,,,,,,,
2023-10-20,sexta-feira ,11:39:00,SEM VÍTIMA,SAO JOSE,RUA,RUA JARAGUARI,,,,SAO JOSE,,SUBURBIO,COLISÃO LATERAL,0,1,0,0,0,0,0,0,0,0,0,,,,,,,,,,,,,
2023-10-21,sábado ,12:10:00,SEM VÍTIMA,TAMARINEIRA,RUA,RUA SILVEIRA DE CARVALHO,,,,TAMARINEIRA,,SUBURBIO,COLISÃO LATERAL,2,0,0,0,0,0,0,0,0,0,0,,,,,,,,,,,,,
2023-10-21,sábado ,04:45:00,COM VÍTIMA,BAIRRO DO RECIFE,CAIS,CAIS DO APOLO,,,PROXIMO A PCR,BAIRRO DO RECIFE,,,ATROPELAMENTO DE PESSOA,1,0,0,0,1,0,0,0,0,1,0,,,,,,,,,,,,,
2023-10-21,sábado ,12:50:00,COM VÍTIMA,AREIAS,RUA,RUA IPOJUCA,,,PROXIMO A ESCOLA PROFISSIONALIZANTE DE AREIAS,AREIAS,,,COLISÃO,0,1,0,0,0,0,0,0,0,1,0,,,,,,,,,,,,,
2023-10-21,sábado ,01:02:00,COM VÍTIMA,TORRE,RUA,RUA REAL DA TORRE,,,PROXIMO AO RECIBOM DA TORRE,TORRE,,,COLISÃO,0,1,0,0,0,0,0,0,0,1,0,,,,,,,,,,,,,
2023-10-21,sábado ,01:09:00,COM VÍTIMA,BOA VIAGEM,RUA,RUA CAPITAO ZUZINHA,,,PROXIMO AO BAR DA AZINHA,BOA VIAGEM,,,COLISÃO,0,1,0,0,0,0,0,0,0,1,0,,,,,,,,,,,,,
2023-10-21,sábado ,01:55:00,COM VÍTIMA,ESPINHEIRO,RUA,RUA QUARENTA E OITO,,,EM FRENTE AO RESTAURANTE SABOR DO RANCHO,ESPINHEIRO,,,COLISÃO,0,1,0,0,0,0,0,0,0,1,0,,,,,,,,,,,,,
2023-10-21,sábado ,02:23:00,COM VÍTIMA,DOIS IRMAOS,RUA,RUA MANUEL DE MEDEIROS,,,PROXIMO AO ARMAZEM COUTO E A UFRPE,DOIS IRMAOS,,,COLISÃO,0,1,0,0,0,0,0,0,0,1,0,,,,,,,,,,,,,
2023-10-21,sábado ,04:08:00,COM VÍTIMA,AREIAS,RUA,RUA RIO SOLIMOES,,,PADARIA SOLIMOES,AREIAS,,,COLISÃO LATERAL,0,0,0,0,0,0,0,0,0,1,0,,,,,,,,,,,,,
2023-10-21,sábado ,04:39:00,COM VÍTIMA,SANTO AMARO,RUA,RUA AURORA,,,INSTITUTO TAVARES BURIL,SANTO AMARO,,,COLISÃO LATERAL,0,0,0,0,0,0,0,0,0,1,0,,,,,,,,,,,,,
2023-10-21,sábado ,05:39:00,COM VÍTIMA,BOA VIAGEM,AVENIDA,AVENIDA ENGENHEIRO DOMINGOS FERREIRA,RUA,RUA CORONEL SERGIO HENRIQUE CARDIM,,BOA VIAGEM,444,,ATROPELAMENTO DE PESSOA,0,0,0,0,1,0,0,0,0,1,0,,,,,,,,,,,,,
2023-10-21,sábado ,10:18:00,COM VÍTIMA,CASA FORTE,AVENIDA,AVENIDA DEZESSETE DE AGOSTO,,,EM FRENTE AO ERMIRIO DE MORAES,CASA FORTE,,,COLISÃO LATERAL,1,1,0,0,0,0,0,0,0,1,0,,,,,,,,,,,,,
2023-10-22,domingo ,02:29:00,COM VÍTIMA,IBURA,AVENIDA,AVENIDA DOIS RIOS,,,,IBURA,,,COLISÃO FRONTAL,1,1,0,0,0,0,0,0,0,1,0,,,,,,,,,,,,,
2023-10-22,domingo ,03:33:00,SEM VÍTIMA,BOA VIAGEM,RUA,RUA DEZ DE JULHO,RUA,RUA CAMBOIM,PRÓXIMO AO ESTABELECIMENTO ALUGUEL BRASIL DE CARROS,BOA VIAGEM,,CIDADE,COLISÃO,2,0,0,0,0,0,0,0,0,0,0,,,,,,,,,,,,,
2023-10-22,domingo ,09:05:00,COM VÍTIMA,IMBIRIBEIRA,AVENIDA,AVENIDA MARECHAL MASCARENHAS DE MORAES,,,EM FRENTE A ENCRUZILHADA PNEUS,IMBIRIBEIRA,,,COLISÃO,2,0,0,0,0,0,0,0,0,1,0,,,,,,,,,,,,,
2023-10-23,segunda-feira ,04:27:00,COM VÍTIMA,MADALENA,RUA,RUA REAL DA TORRE,RUA,RUA PADRE ANCHIETA,NO CRUZAMENTO,MADALENA,192,,COLISÃO,0,1,0,0,0,1,0,0,0,1,0,,,,,,,,,,,,,
2023-10-23,segunda-feira ,06:10:00,COM VÍTIMA,SAO JOSE,AVENIDA,AVENIDA SUL,,,PROX. A FENIX PROMAGEM E GALVANIZAÇÃO SUL,SAO JOSE,260,,COLISÃO LATERAL,0,1,0,0,0,0,0,0,0,1,0,,,,,,,,,,,,,
2023-10-23,segunda-feira ,07:30:00,COM VÍTIMA,PONTO DE PARADA,RUA,RUA PROFESSOR JERONIMO GUEIROS,,,PROX A MARTENIDADE DA ENCRUZILHADA E PROX A FERREIRA PINTO,PONTO DE PARADA,,,COLISÃO,0,1,0,0,0,0,0,0,0,1,0,,,,,,,,,,,,,
2023-10-23,segunda-feira ,07:52:00,COM VÍTIMA,AREIAS,AVENIDA,AVENIDA RECIFE,,,EM FRENTE AO ATACADÃO / SENTIDO BR 232 ',AREIAS,,,COLISÃO,0,1,0,0,0,0,0,0,0,1,0,,,,,,,,,,,,,
2023-10-23,segunda-feira ,07:58:00,COM VÍTIMA,BOA VIAGEM,RUA,RUA WALDEMAR NERY CARNEIRO MONTEIRO,,,PROX. AO RESTAURANTE DONA GULA E COLEGIO PEQUENOS PASSOS,BOA VIAGEM,,,COLISÃO LATERAL,0,1,0,0,0,0,0,0,0,1,0,,,,,,,,,,,,,
2023-10-23,segunda-feira ,08:52:00,COM VÍTIMA,PRADO,RUA,RUA CARLOS GOMES,RUA,RUA JAPECANGA,PROX AO CAVALO DOURADO / EM FRENTE DO ARMAZEM COMECERCIAL VEGA,PRADO,,,COLISÃO FRONTAL,1,1,0,0,0,0,0,0,0,1,0,,,,,,,,,,,,,
2023-10-23,segunda-feira ,09:41:00,COM VÍTIMA,ILHA JOANA BEZERRA,VIADUTO,VIADUTO PAPA JOAO PAULO II,,,EM FRENTE A ESTAÇÃO JOANA BEZERRA, SENT. BOA VIAGEM,ILHA JOANA BEZERRA,,,COLISÃO LATERAL,0,1,0,0,0,0,0,0,0,1,0,,,,,,,,,,,,
2023-10-23,segunda-feira ,11:12:00,COM VÍTIMA,ILHA JOANA BEZERRA,AVENIDA,AVENIDA DES GUERRA BARRETO,,,AO LADO DO FORUM JOANA BEZERRA,ILHA JOANA BEZERRA,,,COLISÃO,0,0,0,0,0,0,0,0,0,1,0,,,,,,,,,,,,,
2023-10-23,segunda-feira ,02:12:00,COM VÍTIMA,ENCRUZILHADA,AVENIDA,AVENIDA BEBERIBE,,,BANCO DO BRASIL,ENCRUZILHADA,,,COLISÃO LATERAL,0,0,0,0,0,0,0,0,0,1,0,,,,,,,,,,,,,
2023-10-23,segunda-feira ,03:58:00,COM VÍTIMA,CAMPO GRANDE,EST,EST DE BELEM,,,PROX AO ANTIGO TERMINAL DE CAMPO GRANDE,CAMPO GRANDE,,,COLISÃO LATERAL,0,0,0,0,0,0,0,0,0,1,0,,,,,,,,,,,,,
2023-10-23,segunda-feira ,06:50:00,COM VÍTIMA,TORROES,AVENIDA,AVENIDA ENGENHEIRO ABDIAS DE CARVALHO,,,PROX. AO CAMARÃO DO LÉONO SENTIDO BR-232,TORROES,,SU,COLISÃO LATERAL,0,0,0,0,0,0,0,0,0,1,0,,,,,,,,,,,,,
2023-10-23,segunda-feira ,09:49:00,COM VÍTIMA,IPSEP,RUA,RUA JEAN EMILE FAVRE,,,EM FRENTE AO POSTO BR,IPSEP,527,,COLISÃO FRONTAL,1,1,0,0,0,0,0,0,0,1,0,,,,,,,,,,,,,
2023-10-24,terça-feira ,07:26:00,COM VÍTIMA,ESPINHEIRO,AVENIDA,AVENIDA GOVERNADOR AGAMENON MAGALHAES,,,EM FRENTE AO SUPERMERCADO BOMPREÇO / SENTIDO OLINDA,ESPINHEIRO,173,,COLISÃO TRASEIRA,1,1,0,0,0,0,0,0,0,1,0,,,,,,,,,,,,,
2023-10-24,terça-feira ,08:04:00,COM VÍTIMA,IBURA,AVENIDA,AVENIDA RECIFE,,,SENT. SAN MARTIN PROX. A JJK AUTOS,IBURA,,,COLISÃO TRASEIRA,1,1,0,0,0,0,0,0,0,1,0,,,,,,,,,,,,,
2023-10-24,terça-feira ,08:42:00,SEM VÍTIMA,CORDEIRO,AVENIDA,AVENIDA GENERAL SAN MARTIN,,,EM FRENTE AO SEMÁFORO DE Nº 058,CORDEIRO,58,SUBURBIO,COLISÃO LATERAL,1,1,0,0,0,0,0,0,0,0,0,,,,,,,,,,,,,
2023-10-24,terça-feira ,08:47:00,COM VÍTIMA,IMBIRIBEIRA,AVENIDA,AVENIDA MARECHAL MASCARENHAS DE MORAES,,,EM FRENTE A LASER ELETRO, SENT. AFOGADOS,IMBIRIBEIRA,,,COLISÃO LATERAL,1,1,0,0,0,0,0,0,0,1,0,,,,,,,,,,,,
2023-10-24,terça-feira ,09:05:00,COM VÍTIMA,TAMARINEIRA,RUA,RUA CONEGO BARATA,,,AO LADO DA CASA DAS PLANTAS,TAMARINEIRA,,,COLISÃO,0,1,0,0,0,0,0,0,0,1,0,,,,,,,,,,,,,
2023-10-24,terça-feira ,09:14:00,COM VÍTIMA,SANTO AMARO,AVENIDA,AVENIDA NORTE MIGUEL ARRAES DE ALENCAR,,,SOBRE O VIADUTO DA AV NORTE /,SANTO AMARO,,,COLISÃO,0,1,0,0,0,0,0,0,0,1,0,,,,,,,,,,,,,
2023-10-24,terça-feira ,10:08:00,COM VÍTIMA,CORDEIRO,RUA,RUA COSME VIANA,,,PRÓXIMO AO CRUZAMENTO DA AV. SÃO MIGUEL,CORDEIRO,,,COLISÃO,0,0,0,0,0,0,0,0,0,1,0,,,,,,,,,,,,,
2023-10-24,terça-feira ,10:41:00,SEM VÍTIMA,IMBIRIBEIRA,RUA,RUA ENGENHEIRO JOSE BRANDAO CAVALCANTE,,,ENTRADA PRINCIPAL DA LAGOA DO ARAÇA,IMBIRIBEIRA,,,COLISÃO LATERAL,1,0,0,0,0,1,0,0,0,0,0,,,,,,,,,,,,,
2023-10-24,terça-feira ,10:46:00,COM VÍTIMA,IPSEP,RUA,RUA ITAIMBE,,,EM FRENTE A LOJA MEU SOFA, PROX. A CADEMIA SELFIT,IPSEP,,,COLISÃO LATERAL,0,1,0,0,0,0,0,0,0,1,0,,,,,,,,,,,,
2023-10-24,terça-feira ,01:11:00,COM VÍTIMA,ILHA DO LEITE,RUA,RUA SAO GONCALO,,,,ILHA DO LEITE,,,COLISÃO,0,0,0,0,0,0,0,0,0,1,0,,,,,,,,,,,,,
2023-10-24,terça-feira ,01:16:00,SEM VÍTIMA,VARZEA,RUA,RUA CORONEL PACHECO,,,PRAÇA DA VÁRZEA,VARZEA,,CIDADE,COLISÃO LATERAL,1,0,0,0,0,0,0,1,0,0,0,,,,,,,,,,,,,
2023-10-24,terça-feira ,04:26:00,SEM VÍTIMA,GRACAS,RUA,RUA SENADOR ALBERTO PAIVA,,,PORTÃO LATERAL DO MUSEU DO ESTADO DE PERNAMBUCO,GRACAS,,SUBURBIO,COLISÃO TRASEIRA,1,0,0,0,0,0,0,1,0,0,0,,,,,,,,,,,,,
2023-10-24,terça-feira ,05:00:00,COM VÍTIMA,BEBERIBE,AVENIDA,AVENIDA BEBERIBE,,,PROXIMO AO POSTO DE GASOLINA SUVINE E AO INOCOOP,BEBERIBE,,,COLISÃO,1,0,0,0,0,0,0,0,0,1,0,,,,,,,,,,,,,
2023-10-24,terça-feira ,05:38:00,COM VÍTIMA,IPSEP,RUA,RUA JEAN EMILE FAVRE,,,PROXIMO A PADARIA VILA DO PÃO,IPSEP,,,COLISÃO LATERAL,1,1,0,0,0,0,0,0,0,2,0,,,,,,,,,,,,,
2023-10-24,terça-feira ,06:26:00,COM VÍTIMA,SAO JOSE,RUA,RUA IMPERIAL,,,PROX AO VIADUTO DE JOANA BEZERRA,SAO JOSE,,,COLISÃO TRANSVERSAL,2,0,0,0,0,0,0,0,0,2,0,,,,,,,,,,,,,
2023-10-24,terça-feira ,06:55:00,COM VÍTIMA,GUABIRABA,AVENIDA,AVENIDA DA RECUPERACAO,,,OFICINA DE MOLAS,GUABIRABA,,,COLISÃO LATERAL,0,0,0,0,0,0,0,0,0,1,0,,,,,,,,,,,,,
2023-10-24,terça-feira ,06:55:00,COM VÍTIMA,JOANA BEZERRA,RUA,RUA IMPERIAL,,,EM BAIXO DO VIADUTO CAPITÃO TEMUDO,JOANA BEZERRA,,,COLISÃO LATERAL,0,0,0,0,0,0,0,0,0,1,0,,,,,,,,,,,,,
2023-10-24,terça-feira ,08:13:00,COM VÍTIMA,JORDAO,AVENIDA,AVENIDA MARIA IRENE,,,EM FRENTE A IGREJA DE DEUS NOVO TEMPO E O POSTO TOTAL,JORDAO,,,COLISÃO,0,0,0,0,0,0,0,0,0,1,0,,,,,,,,,,,,,
2023-10-24,terça-feira ,08:38:00,SEM VÍTIMA,ARRUDA,AVENIDA,AVENIDA BEBERIBE,,,EM FRENTE AO CAMPO DO ARRUDA E DO ARMAZÉM CORAL,ARRUDA,,,COLISÃO,0,0,0,0,0,0,0,0,0,0,0,,,,,,,,,,,,,
2023-10-24,terça-feira ,09:57:00,COM VÍTIMA,IMBIRIBEIRA,VIADUTO,VIADUTO TANCREDO NEVES,,,ALÇA DE ACESSO A MASCARENHAS, SENTIDO UPA DA IMBIRIBEIRA,IMBIRIBEIRA,,,CAPOTAMENTO,2,0,0,0,0,0,0,0,0,2,0,,,,,,,,,,,,
2023-10-24,terça-feira ,11:51:00,COM VÍTIMA,JOANA BEZERRA,VIADUTO,VIADUTO CAPITAO TEMUDO,,,SOBRE O VIADUTO,JOANA BEZERRA,,,COLISÃO,0,0,0,0,0,0,0,0,0,1,0,,,,,,,,,,,,,
2023-10-25,quarta-feira ,12:05:00,COM VÍTIMA,IPSEP,AVENIDA,AVENIDA RECIFE,,,ANTES DO PAN DE AREIAS,IPSEP,212,,COLISÃO,0,0,0,0,0,0,0,0,0,2,0,,,,,,,,,,,,,
2023-10-25,quarta-feira ,05:36:00,COM VÍTIMA,MACAXEIRA,AVENIDA,AVENIDA NORTE MIGUEL ARRAES DE ALENCAR,,,PRÓXIMO AO TERMINAL DA MACAXEIRA,MACAXEIRA,,,CHOQUE,0,0,0,0,0,0,0,0,0,1,0,,,,,,,,,,,,,
2023-10-25,quarta-feira ,08:21:00,COM VÍTIMA,CASA AMARELA,RUA,RUA PADRE LEMOS,,,EM FRENTE A KINITOS E ARMAZEM FERREIRA PINTO,CASA AMARELA,,,COLISÃO LATERAL,0,1,0,0,0,0,0,0,0,1,0,,,,,,,,,,,,,
2023-10-25,quarta-feira ,08:22:00,COM VÍTIMA,BEBERIBE,AVENIDA,AVENIDA BEBERIBE,,,EM FRENTE AO ATACAREJO SUPER MIX,BEBERIBE,,,ATROPELAMENTO DE PESSOA,0,1,0,0,1,0,0,0,0,1,0,,,,,,,,,,,,,
2023-10-25,quarta-feira ,09:18:00,COM VÍTIMA,SAO JOSE,AVENIDA,AVENIDA SUL,,,APOS AS TORRES GEMEAS, PROX. AO CAIS DE SANTA RITA EM FRENTE AO HOTEL EM CONSTRUÇÃO,SAO JOSE,,,COLISÃO LATERAL,0,1,0,0,0,0,0,0,0,1,0,,,,,,,,,,,,
2023-10-25,quarta-feira ,09:47:00,COM VÍTIMA,AGUA FRIA,EST,EST VELHA DE AGUA FRIA,,,EM FRENTE ACADEMIA MEGA BOX / PROX A POLICLINICA SALOMÃO KELMER,AGUA FRIA,,,COLISÃO,0,1,0,0,0,0,0,0,0,1,0,,,,,,,,,,,,,
2023-10-25,quarta-feira ,09:53:00,COM VÍTIMA,ARRUDA,AVENIDA,AVENIDA PROFESSOR JOSE DOS ANJOS,,,PROX A PADARIA PAN CRISTAL,ARRUDA,,,COLISÃO COM CICLISTA,1,0,0,1,1,0,0,0,0,2,0,,,,,,,,,,,,,
2023-10-25,quarta-feira ,12:24:00,SEM VÍTIMA,AREIAS,AVENIDA,AVENIDA DR JOSE RUFINO,,,ARMAZEM COMERCIAL NOVO LAR,AREIAS,,SUBURBIO,COLISÃO TRASEIRA,3,0,0,0,0,0,0,0,0,0,0,,,,,,,,,,,,,
2023-10-25,quarta-feira ,01:41:00,COM VÍTIMA,MADALENA,AVENIDA,AVENIDA VISCONDE DE ALBUQUERQUE,,,PROX GALERIA MADALENA CENTER,MADALENA,,,COLISÃO FRONTAL,1,1,0,0,0,0,0,0,0,1,0,,,,,,,,,,,,,
2023-10-25,quarta-feira ,02:16:00,COM VÍTIMA,ROSARINHO,AVENIDA,AVENIDA NORTE MIGUEL ARRAES DE ALENCAR,,,PROXIMO A PADARIA ROSARINHO,ROSARINHO,,,COLISÃO,0,1,0,0,0,0,0,0,0,1,0,,,,,,,,,,,,,
2023-10-25,quarta-feira ,02:26:00,COM VÍTIMA,TORREAO,AVENIDA,AVENIDA NORTE MIGUEL ARRAES DE ALENCAR,,,PROXIMO AO VIADUTO DA AV NORTE E AO LADO DA CONCESSIONARIA CHEVROLET,TORREAO,,CIDADE,COLISÃO,0,1,0,0,0,0,0,0,0,1,0,,,,,,,,,,,,,
2023-10-25,quarta-feira ,03:16:00,COM VÍTIMA,DOIS IRMAOS,RUA,RUA MANUEL DE MEDEIROS,,,ZOOTECNIA DA UNIVERSIDADE RURAL,DOIS IRMAOS,,,COLISÃO LATERAL,0,0,0,0,0,0,0,0,0,1,0,,,,,,,,,,,,,
2023-10-25,quarta-feira ,04:21:00,SEM VÍTIMA,DERBY,AVENIDA,AVENIDA GOVERNADOR AGAMENON MAGALHAES,,,EM FRENTE AO TRIBUNAL REGIONAL ELEITORAL  DE PERNAMBUCO,,,CIDADE,COLISÃO LATERAL,0,0,0,0,0,1,0,1,0,0,0,,,,,,,,,,,,,
2023-10-25,quarta-feira ,04:21:00,COM VÍTIMA,BARRO,AVENIDA,AVENIDA DR JOSE RUFINO,,,ESCOLA CRECHE  PRESIDENTE TANGREDO NEVES,BARRO,,,COLISÃO LATERAL,0,0,0,0,0,0,0,0,0,1,0,,,,,,,,,,,,,
2023-10-25,quarta-feira ,04:53:00,COM VÍTIMA,CAMPO GRANDE,RUA,RUA JERONIMO VILELA,RUA,RUA ODORICO MENDES,PROX AO COLEGIO JESUS CRUCIFICADO,CAMPO GRANDE,,,COLISÃO TRASEIRA,1,1,0,0,0,0,0,0,0,1,0,,,,,,,,,,,,,
2023-10-25,quarta-feira ,05:59:00,COM VÍTIMA,FUNDAO,AVENIDA,AVENIDA BEBERIBE,,,INDO PELA ESTRADA VELHA DE ÁGUA FRIA ANTES DO POSTO CAJUEIRO,FUNDAO,,,COLISÃO LATERAL,0,0,0,0,0,0,0,0,0,1,0,,,,,,,,,,,,,
2023-10-25,quarta-feira ,08:04:00,SEM VÍTIMA,SANTO ANTONIO,AVENIDA,AVENIDA MARTINS DE BARROS,,,APÓS A ESTAÇÃO DO BRT MAURICIO DE NASSAU,SANTO ANTONIO,,SUBURBIO,COLISÃO LATERAL,0,0,0,0,0,1,0,1,0,0,0,,,,,,,,,,,,,
2023-10-26,quinta-feira ,07:08:00,COM VÍTIMA,BOA VISTA,AVENIDA,AVENIDA GOVERNADOR AGAMENON MAGALHAES,,,NA SAÍDA RUA DOM BOSCO, PROXIMO A RESTAURAÇÃO, SENTIDO OLINDA,BOA VISTA,,,COLISÃO,0,2,0,0,0,0,0,0,0,2,0,,,,,,,,,,,
2023-10-26,quinta-feira ,08:14:00,SEM VÍTIMA,ARRUDA,RUA,RUA DAS MOCAS,,,AO LADO ESTÁDIO DO SANTA CRUZ,ARRUDA,,CIDADE,COLISÃO LATERAL,1,1,0,0,0,0,0,0,0,0,0,,,,,,,,,,,,,
2023-10-26,quinta-feira ,08:33:00,COM VÍTIMA,BOA VISTA,AVENIDA,AVENIDA CONDE DA BOA VISTA,,,EM FRENTE AO COPE, SENTIDO GUARARAPES,BOA VISTA,,,COLISÃO TRASEIRA,0,0,0,1,0,1,0,0,0,1,0,,,,,,,,,,,,
2023-10-26,quinta-feira ,08:41:00,COM VÍTIMA,PINA,AVENIDA,AVENIDA CONSELHEIRO AGUIAR,AVENIDA,AVENIDA ANTONIO DE GOES,EM FRENTE A PERNAMBUCO MOTOS,PINA,,,COLISÃO FRONTAL,1,1,0,0,0,0,0,0,0,1,0,,,,,,,,,,,,,
2023-10-26,quinta-feira ,09:03:00,COM VÍTIMA,PONTO DE PARADA,AVENIDA,AVENIDA BEBERIBE,,,EM FRENTE A LOJA PEDRAGON, PROX. AO CAMPO DO ARRUDA,PONTO DE PARADA,,,COLISÃO LATERAL,0,1,0,0,0,0,0,0,0,1,0,,,,,,,,,,,,
2023-10-26,quinta-feira ,11:31:00,COM VÍTIMA,MADALENA,RUA,RUA JOSE OSORIO,,,PROX AO MERCADO PUBLICO DA MADALENA,MADALENA,,,COLISÃO,0,1,0,0,0,0,0,0,0,1,0,,,,,,,,,,,,,
2023-10-26,quinta-feira ,11:32:00,COM VÍTIMA,IBURA,LAD,LAD DA COHAB,,,LADEIRA DA COHAB,IBURA,,,COLISÃO,0,0,0,0,0,0,0,0,0,1,0,,,,,,,,,,,,,
2023-10-26,quinta-feira ,03:38:00,SEM VÍTIMA,CASA AMARELA,RUA,RUA PADRE LEMOS,RUA,RUA DR TOME DIAS,CASA PIO CALÇADOS,CASA AMARELA,,CIDADE,COLISÃO TRASEIRA,2,0,0,0,0,0,0,0,0,0,0,,,,,,,,,,,,,
2023-10-26,quinta-feira ,03:52:00,SEM VÍTIMA,SAO JOSE,AVENIDA,AVENIDA DANTAS BARRETO,,,EM FRENTE A DISTRIBUIDORA MIX,SAO JOSE,,SUBURBIO,COLISÃO LATERAL,0,0,0,0,0,0,0,1,0,0,0,,,,,,,,,,,,,
2023-10-26,quinta-feira ,06:30:00,COM VÍTIMA,JORDAO,AVENIDA,AVENIDA MARIA IRENE,,,AO LADO DA BASE AEREA,JORDAO,,,COLISÃO LATERAL,0,1,0,0,0,0,0,0,0,1,0,,,,,,,,,,,,,
2023-10-26,quinta-feira ,06:30:00,COM VÍTIMA,IBURA,AVENIDA,AVENIDA DOIS RIOS,,,MERCADINHO M R,IBURA,,,COLISÃO LATERAL,0,1,0,0,0,0,0,0,0,1,0,,,,,,,,,,,,,
2023-10-27,sexta-feira ,07:07:00,COM VÍTIMA,PINA,AVENIDA,AVENIDA ENGENHEIRO DOMINGOS FERREIRA,,,EM FRENTE A ESCOLA MUNICIPAL OSVALDO LIMA FILHO /  EM FRENTE AO ARMAZEM BOA VIAGEM, SENTIDO BOA VIAGEM,PINA,,,COLISÃO,0,1,0,0,0,0,0,0,0,1,0,,,,,,,,,,,,
2023-10-27,sexta-feira ,07:46:00,COM VÍTIMA,BOA VIAGEM,RUA,RUA ERNESTO DE PAULA SANTOS,,,RUA DA UNINASSAU,BOA VIAGEM,,,COLISÃO LATERAL,0,1,0,0,0,0,0,0,0,1,0,,,,,,,,,,,,,
2023-10-27,sexta-feira ,08:10:00,COM VÍTIMA,CAXANGA,AVENIDA,AVENIDA CAXANGA,,,APÓS A GREGORIO JUNIOR,CAXANGA,,,ATROPELAMENTO DE PESSOA,0,1,0,0,1,0,0,0,0,3,0,,,,,,,,,,,,,
2023-10-27,sexta-feira ,08:35:00,COM VÍTIMA,IMBIRIBEIRA,AVENIDA,AVENIDA PRESIDENTE DUTRA,,,PRÓXIMO À LOCAVEL E AO SAL E BRASA,IMBIRIBEIRA,,,COLISÃO LATERAL,0,0,0,0,0,0,0,0,0,1,0,,,,,,,,,,,,,
2023-10-27,sexta-feira ,09:30:00,COM VÍTIMA,IMBIRIBEIRA,AVENIDA,AVENIDA RECIFE,,,SUB. DO VIADUTO TANCREDO NEVES, NO FINAL DA AV. RECIFE,IMBIRIBEIRA,,,COLISÃO LATERAL,0,1,0,0,0,0,0,0,0,1,0,,,,,,,,,,,,
2023-10-27,sexta-feira ,10:42:00,COM VÍTIMA,BOA VIAGEM,AVENIDA,AVENIDA CONSELHEIRO AGUIAR,RUA,RUA FELIX DE BRITO E MELO,,BOA VIAGEM,,,ATROPELAMENTO DE PESSOA,0,1,0,0,1,0,0,0,0,1,0,,,,,,,,,,,,,
2023-10-27,sexta-feira ,10:47:00,VÍTIMA FATAL,NOVA DESCOBERTA,RUA,RUA NOVA DESCOBERTA,,,EM FRENTE AO BAR DO VVVI E ASSEMBLEIA DE DEUS,NOVA DESCOBERTA,,,COLISÃO COM CICLISTA,1,0,0,1,0,0,0,0,0,1,1,,,,,,,,,,,,,
2023-10-27,sexta-feira ,11:49:00,COM VÍTIMA,BOA VISTA,PTE,PTE SEIS DE MARCO,,,EM CIMA DA PONTE VELHA, SENT. CASA DA CULTURA,BOA VISTA,,,COLISÃO LATERAL,0,1,0,0,0,0,0,0,0,1,0,,,,,,,,,,,,
2023-10-27,sexta-feira ,12:12:00,COM VÍTIMA,IBURA,AVENIDA,AVENIDA DOM HELDER CAMARA,,,SENTIDO BR, IBURA DE BAIXO PISTA NOVA PROX AO ARMAZEM CORAL,IBURA,,,COLISÃO,0,1,0,0,0,0,0,0,0,1,0,,,,,,,,,,,,
2023-10-27,sexta-feira ,03:35:00,COM VÍTIMA,IMBIRIBEIRA,RUA,RUA OLIVIA MENELAU,,,EM FRENTE AO GRILO,IMBIRIBEIRA,,,COLISÃO LATERAL,0,1,0,0,0,0,1,0,0,1,0,,,,,,,,,,,,,
2023-10-27,sexta-feira ,04:26:00,COM VÍTIMA,CORDEIRO,RUA,RUA CORONEL FERNANDO FURTADO,,,AO LADO DA EXPOSIÇÃO DE ANIMAIS,CORDEIRO,,,COLISÃO LATERAL,0,0,0,0,0,0,0,0,0,1,0,,,,,,,,,,,,,
2023-10-27,sexta-feira ,05:23:00,COM VÍTIMA,BAIRRO DO RECIFE,CAIS,CAIS DO APOLO,,,ENTRE  O BANCO DO BRASIL E O PORTO DIGITAL,BAIRRO DO RECIFE,,,COLISÃO LATERAL,0,1,0,0,0,1,0,0,0,1,0,,,,,,,,,,,,,
2023-10-27,sexta-feira ,05:23:00,COM VÍTIMA,PINA,AVENIDA,AVENIDA ANTONIO DE GOES,,,CIA DO SORRISO,PINA,,,ATROPELAMENTO DE PESSOA,0,1,0,0,1,0,0,0,0,1,0,,,,,,,,,,,,,
2023-10-28,sábado ,07:36:00,COM VÍTIMA,ARRUDA,RUA,RUA DAS MOCAS,RUA,RUA DA REGENERACAO,PROX AO SEMAFORO 472 / PROX AO MERDINHO MIX,ARRUDA,,,COLISÃO,1,1,0,0,0,0,0,0,0,2,0,,,,,,,,,,,,,
2023-10-28,sábado ,07:52:00,COM VÍTIMA,BOA VIAGEM,RUA,RUA DES JOAO PAES,,,PROX. AO RETAURANTE GUAIAMUM,BOA VIAGEM,,,COLISÃO LATERAL,0,1,0,0,0,0,0,0,0,1,0,,,,,,,,,,,,,
2023-10-28,sábado ,10:22:00,SEM VÍTIMA,ESPINHEIRO,RUA,RUA DO ESPINHEIRO,,,,ESPINHEIRO,,CIDADE,COLISÃO TRASEIRA,1,1,0,0,0,0,0,0,0,0,0,,,,,,,,,,,,,
2023-10-28,sábado ,11:04:00,COM VÍTIMA,CORDEIRO,AVENIDA,AVENIDA PROFESSOR ESTEVAO FRANCISCO DA COSTA,,,PROX AO MERCADINHO SANTIAGO / SENTIDO HOSPITAL GETULHO  VARGAS,CORDEIRO,,,COLISÃO LATERAL,1,1,0,0,0,0,0,0,0,1,0,,,,,,,,,,,,,
2023-10-28,sábado ,11:19:00,COM VÍTIMA,IBURA,RUA,RUA RIO DA PRATA,,,PROX. AO SUPERMERCADO MR E VIDRAÇARIA DOIS RIOS IBURA DE BAIXO,IBURA,,,COLISÃO LATERAL,1,1,0,0,0,0,0,0,0,1,0,,,,,,,,,,,,,
2023-10-28,sábado ,12:13:00,COM VÍTIMA,SAO JOSE,RUA,RUA VINTE E TRES DE MARCO,,,AO LADO DA CASA DA CULTURA / SOBRE PONTE VELHA,SAO JOSE,,,COLISÃO TRASEIRA,1,1,0,0,0,0,0,0,0,1,0,,,,,,,,,,,,,
2023-10-28,sábado ,02:50:00,COM VÍTIMA,CAMPO GRANDE,AVENIDA,AVENIDA PROFESSOR JOSE DOS ANJOS,,,LANCHONETE MATA FOME,CAMPO GRANDE,,,QUEDA,0,0,0,0,0,0,0,0,0,1,0,,,,,,,,,,,,,
2023-10-28,sábado ,03:36:00,COM VÍTIMA,CAXANGA,AVENIDA,AVENIDA CAXANGA,,,PACIENTE DENTRO DO GOLF COUNTRY CLUB,CAXANGA,,,COLISÃO LATERAL,0,0,0,0,0,0,0,0,0,1,0,,,,,,,,,,,,,
2023-10-28,sábado ,04:48:00,SEM VÍTIMA,CASA AMARELA,EST,EST DO ARRAIAL,,,LADO MERCADO DE CASA AMARELA,CASA AMARELA,,,CHOQUE,0,0,0,0,0,0,0,0,0,0,0,,,,,,,,,,,,,
2023-10-28,sábado ,05:44:00,COM VÍTIMA,DERBY,AVENIDA,AVENIDA GOVERNADOR AGAMENON MAGALHAES,,,EM FRENTE A MECDONALDS,DERBY,75,,COLISÃO COM CICLISTA,0,1,0,1,0,0,0,0,0,1,0,,,,,,,,,,,,,
2023-10-28,sábado ,05:53:00,COM VÍTIMA,SAO JOSE,RUA,RUA BOM SUCESSO,,,PROX AO VIADUTO CAPITÃO TEMUDO,SAO JOSE,,,COLISÃO FRONTAL,2,0,0,0,0,0,0,0,0,2,0,,,,,,,,,,,,,
2023-10-28,sábado ,11:07:00,COM VÍTIMA,SAN MARTIN,AVENIDA,AVENIDA GENERAL SAN MARTIN,,,PRÓXIMO A PRAÇA DA INFANCIA,SAN MARTIN,,,COLISÃO,0,0,0,0,0,0,0,0,0,1,0,,,,,,,,,,,,,
2023-10-29,domingo ,08:07:00,COM VÍTIMA,GRACAS,RUA,RUA CRUZ DAS GRACAS,,,PROX A IGREJA DAS GRAÇAS, EM FRENTE AO EDF NOSSA SENHORA DAS GRAÇAS,GRACAS,,,COLISÃO,1,1,0,0,0,0,0,0,0,2,0,,,,,,,,,,,,
2023-10-29,domingo ,09:26:00,COM VÍTIMA,CASA FORTE,AVENIDA,AVENIDA FLOR DE SANTANA,,,PROX AO BURGUER KING / PROX AO LAVA JATO,CASA FORTE,,,COLISÃO,0,1,0,0,0,0,0,0,0,1,0,,,,,,,,,,,,,
