data,dia_semana,hora,natureza,bairro,logradouro_endereco,endereco,logradouro_detalhe_endereço,detalhe_endereco_acidente,complemento,bairro_cruzamento,num_semaforo,sentido_via,tipo,auto,moto,ciclom,ciclista,pedestre,onibus,caminhao,viatura,outros,vitimas,vitimasfatais,acidente_verificado,tempo_clima,situacao_semaforo,sinalizacao,condicao_via,conservacao_via,ponto_controle,situacao_placa,velocidade_max_via,mao_direcao,divisao_via1,divisao_via2,divisao_via3
2023-04-29,sábado ,11:43:00,COM VÍTIMA,CORDEIRO,RUA,RUA AMBROSIO MACHADO,,,EM FRENTE AO EDF. LORENA NUNES,CORDEIRO,,,COLISÃO LATERAL,1,1,0,0,0,0,0,0,0,2,0,,,,,,,,,,,,,
2023-04-29,sábado ,01:05:00,COM VÍTIMA,BOA VIAGEM,RUA,RUA GENERAL EDSON AMANCIO RAMALHO,RUA,RUA FAUSTINO PORTO,AO LADO DO BIG BOMPREÇO,BOA VIAGEM,,,COLISÃO TRASEIRA,1,1,0,0,0,0,0,0,0,1,0,,,,,,,,,,,,,
2023-04-29,sábado ,02:54:00,COM VÍTIMA,ARRUDA,AVENIDA,AVENIDA PROFESSOR JOSE DOS ANJOS,,,AO LADO DO BOMPREÇO,ARRUDA,,,COLISÃO LATERAL,1,1,0,0,0,0,0,0,0,1,0,,,,,,,,,,,,,
2023-04-29,sábado ,04:35:00,SEM VÍTIMA,TORREAO,RUA,RUA DOM JOAO COSTA,,,DE FRENTE A PRAÇA DO TORREÃO,TORREÃO,,,COLISÃO LATERAL,1,1,0,0,0,0,0,0,0,0,0,,,,,,,,,,,,,
2023-04-30,domingo ,06:53:00,COM VÍTIMA,CASA AMARELA,EST,EST DO ARRAIAL,,,PROXIMO A  ESCOLA MUNICIPAL,CASA AMARELA,,,CHOQUE,0,1,0,0,0,0,0,0,0,2,0,,,,,,,,,,,,,
2023-04-30,domingo ,10:07:00,COM VÍTIMA,BOA VIAGEM,AVENIDA,AVENIDA ENGENHEIRO DOMINGOS FERREIRA,RUA,RUA CORONEL BENEDITO CHAVES,,BOA VIAGEM,,,COLISÃO TRANSVERSAL,1,1,0,0,0,0,0,0,0,1,0,,,,,,,,,,,,,
2023-04-30,domingo ,11:25:00,COM VÍTIMA,SAN MARTIN,AVENIDA,AVENIDA GENERAL SAN MARTIN,,,EM FRENTE O CORREIOS,SAN MARTIN,,,COLISÃO TRASEIRA,1,1,0,0,0,0,0,0,0,1,0,,,,,,,,,,,,,
2023-04-30,domingo ,11:42:00,COM VÍTIMA,BOA VIAGEM,AVENIDA,AVENIDA CELSO FURTADO (VIA MANGUE),,,PROX AO MERCADO AÇAI,BOA VIAGEM,,,COLISÃO LATERAL,2,0,0,0,0,0,0,0,0,1,0,,,,,,,,,,,,,
2023-05-01,segunda-feira ,11:21:00,SEM VÍTIMA,DOIS UNIDOS,AVENIDA,AVENIDA HILDEBRANDO DE VASCONCELOS,,,PROX AO TERMINAL DE ONIBUS EM FRENTE A RESIDENCIA 29,DOIS UNIDOS,,,COLISÃO FRONTAL,1,1,0,0,0,0,0,0,0,0,0,,,,,,,,,,,,,
2023-05-01,segunda-feira ,12:51:00,COM VÍTIMA,TORRE,RUA,RUA CONDE DE IRAJA,AVENIDA,AVENIDA BEIRA RIO,,TORRE,,,CHOQUE,2,0,0,0,0,0,0,0,0,1,0,,,,,,,,,,,,,
2023-05-01,segunda-feira ,05:07:00,COM VÍTIMA,IBURA,RUA,RUA VALE DO ITAJAI,,,UPA DA LAGOA ENCANTADA,IBURA,,,ATROPELAMENTO DE PESSOA,1,0,0,0,1,0,0,0,0,2,0,,,,,,,,,,,,,
2023-05-01,segunda-feira ,05:32:00,COM VÍTIMA,IMBIRIBEIRA,AVENIDA,AVENIDA MARECHAL MASCARENHAS DE MORAES,,,EM FRENTE AO AEROPORTO,IMBIRIBEIRA,,,ATROPELAMENTO DE PESSOA,1,0,0,0,1,0,0,0,0,1,0,,,,,,,,,,,,,
2023-05-01,segunda-feira ,06:01:00,COM VÍTIMA,IPUTINGA,AVENIDA,AVENIDA MAURICIO DE NASSAU,RUA,RUA SAO MATEUS,EM FRENTE COXINHA DO NOBRE,IPUTINGA,,,COLISÃO LATERAL,1,1,0,0,0,0,0,0,0,2,0,,,,,,,,,,,,,
2023-05-01,segunda-feira ,11:07:00,COM VÍTIMA,MADALENA,AVENIDA,AVENIDA VISCONDE DE ALBUQUERQUE,RUA,RUA JOSE OSORIO,EM FRENTE A FARMACIA DO TRABALHADOR,MADALENA,,,COLISÃO TRANSVERSAL,1,1,0,0,0,0,0,0,0,2,0,,,,,,,,,,,,,
2023-05-02,terça-feira ,08:24:00,COM VÍTIMA,IMBIRIBEIRA,AVENIDA,AVENIDA GENERAL MAC ARTHUR,,,EM FRENTE AO LE PARC,IMBIRIBEIRA,,,QUEDA,0,1,0,0,0,0,0,0,0,1,0,,,,,,,,,,,,,
2023-05-02,terça-feira ,08:58:00,COM VÍTIMA,DOIS IRMAOS,RUA,RUA PROF CLAUDIO SELVA,,,ANTES DO VALE DO AMANHECER EM FRENTE AO N179,DOIS IRMÃOS,,,COLISÃO LATERAL,1,1,0,0,0,0,0,0,0,1,0,,,,,,,,,,,,,
2023-05-02,terça-feira ,10:19:00,SEM VÍTIMA,DOIS IRMAOS,RUA,RUA DOIS IRMAOS,,,SEMÁFORO 416,DOIS IRMÃOS,,,APOIO CELPE,0,0,0,0,0,0,0,0,0,0,0,,,,,,,,,,,,,
2023-05-02,terça-feira ,10:23:00,COM VÍTIMA,GRACAS,RUA,RUA ALBERTO PAIVA,,,A OCORRÊNCIA FICA NA RUA Senador Alberto Paiva / SEMÁFORO 360,GRAÇAS,,,COLISÃO TRASEIRA,1,1,0,0,0,0,0,0,0,1,0,,,,,,,,,,,,,
2023-05-02,terça-feira ,04:31:00,COM VÍTIMA,AFOGADOS,RUA,RUA DA PAZ,,,PROX A ESTAÇAO DO LARGO DA PAZ,AFOGADOS,,,COLISÃO LATERAL,0,1,0,0,0,0,1,0,0,1,0,,,,,,,,,,,,,
2023-05-02,terça-feira ,05:01:00,COM VÍTIMA,BOA VIAGEM,AVENIDA,AVENIDA CONSELHEIRO AGUIAR,,,E/F AO BANCO SAFRA,BOA VIAGEM,,,COLISÃO LATERAL,1,1,0,0,0,0,0,0,0,2,0,,,,,,,,,,,,,
2023-05-02,terça-feira ,05:11:00,COM VÍTIMA,BOA VIAGEM,AVENIDA,AVENIDA DES JOSE NEVES,TUNEL,TUNEL AUGUSTO LUCENA,,BOA VIAGEM,,SUBURBIO,COLISÃO LATERAL,0,2,0,0,0,0,0,0,0,1,0,,,,,,,,,,,,,
2023-05-02,terça-feira ,06:18:00,COM VÍTIMA,SANTO AMARO,RUA,RUA TREZE DE MAIO,,,PRÓXIMO À AVENIDA NORTE,SANTO AMARO,,,COLISÃO LATERAL,0,0,0,0,0,0,0,0,0,1,0,,,,,,,,,,,,,
2023-05-02,terça-feira ,06:19:00,COM VÍTIMA,IBURA,AVENIDA,AVENIDA DOIS RIOS,RUA,RUA RIO XINGU,,IBURA,,,ATROPELAMENTO DE PESSOA,1,0,0,0,1,0,0,0,0,1,0,,,,,,,,,,,,,
2023-05-02,terça-feira ,07:31:00,COM VÍTIMA,CAXANGA,AVENIDA,AVENIDA CAXANGA,,,APÓS O VIADUTO DA CAXANGÁ SENTIDO  CAMARAGIBE,CAXANGÁ,,,COLISÃO COM CICLISTA,1,0,0,1,0,0,0,0,0,1,0,,,,,,,,,,,,,
2023-05-02,terça-feira ,07:47:00,COM VÍTIMA,CAMPO GRANDE,EST,EST DE BELEM,,,PRÓX. À FARMÁCIA DROGASIL,CAMPO GRANDE,,,COLISÃO TRASEIRA,0,1,0,0,0,0,0,0,1,1,0,,,,,,,,,,,,,
2023-05-02,terça-feira ,09:05:00,SEM VÍTIMA,PAISSANDU,AVENIDA,AVENIDA GOVERNADOR AGAMENON MAGALHAES,RUA,RUA PAISSANDU,PRÓXIMO AO BURG KING PAISSANDU,PAISSANDU,,SUBURBIO,,1,0,0,0,0,0,1,0,0,0,0,,,,,,,,,,,,,
2023-05-03,quarta-feira ,08:23:00,COM VÍTIMA,ENCRUZILHADA,EST,EST DE BELEM,,,EM FRENTE AO EDF. AQUILES E PROX AO SEFAZ,ENCRUZILHADA,,,COLISÃO TRASEIRA,1,1,0,0,0,0,0,0,0,1,0,,,,,,,,,,,,,
2023-05-03,quarta-feira ,09:26:00,COM VÍTIMA,SANTO AMARO,AVENIDA,AVENIDA NORTE MIGUEL ARRAES DE ALENCAR,,,APOS A PRAÇA DA PICANHA, EM CIMA DO VIADUTO SENT. CIDADE,SANTO AMARO,,,COLISÃO FRONTAL,1,1,0,0,0,0,0,0,0,1,0,,,,,,,,,,,,
2023-05-03,quarta-feira ,09:29:00,COM VÍTIMA,MADALENA,EST,EST DOS REMEDIOS,AVENIDA,AVENIDA ENGENHEIRO ABDIAS DE CARVALHO,EM FRENTE A FARMACIA INDEPENDENTE,MADALENA,,,COLISÃO LATERAL,0,2,0,0,0,0,0,0,0,2,0,,,,,,,,,,,,,
2023-05-03,quarta-feira ,11:40:00,SEM VÍTIMA,IMBIRIBEIRA,AVENIDA,AVENIDA MARECHAL MASCARENHAS DE MORAES,,,EM FRENTE AO NÚMERO 1043,IMBIRIBEIRA,,CIDADE,,2,0,0,0,0,0,0,0,0,0,0,,,,,,,,,,,,,
2023-05-03,quarta-feira ,12:10:00,COM VÍTIMA,BONGI,AVENIDA,AVENIDA ENGENHEIRO ABDIAS DE CARVALHO,,,CENTRO DE TREINAMENTO DOS CORREIOS,BONGI,,,COLISÃO TRASEIRA,1,1,0,0,0,0,0,0,0,1,0,,,,,,,,,,,,,
2023-05-03,quarta-feira ,01:12:00,COM VÍTIMA,IPSEP,AVENIDA,AVENIDA RECIFE,,,E/F A CHURRASCARIA E PETISCARIA PAJUÇARA  S/T BOA VIAGEM,IPSEP,,,COLISÃO TRASEIRA,1,1,0,0,0,0,0,0,0,1,0,,,,,,,,,,,,,
2023-05-03,quarta-feira ,03:03:00,COM VÍTIMA,TEJIPIO,AVENIDA,AVENIDA DR JOSE RUFINO,,,EM FRENTE À ESTAÇÃO TEJIPIÓ,TEJIPIÓ,,SUB0,COLISÃO TRASEIRA,0,0,0,0,0,0,0,0,0,1,0,,,,,,,,,,,,,
2023-05-03,quarta-feira ,03:58:00,COM VÍTIMA,TEJIPIO,RUA,RUA PAPA JOAO VINTE E TRES,RUA,RUA FALCAO DE LACERDA,E/F A FABRICA DE PADARIA,TEJIPIÓ,,,COLISÃO LATERAL,1,1,0,0,0,0,0,0,0,1,0,,,,,,,,,,,,,
2023-05-03,quarta-feira ,04:16:00,COM VÍTIMA,NOVA DESCOBERTA,AVENIDA,AVENIDA VEREADOR OTACILIO AZEVEDO,,,,NOVA DESCOBERTA,,,COLISÃO FRONTAL,0,0,0,0,0,0,0,0,0,1,0,,,,,,,,,,,,,
2023-05-03,quarta-feira ,10:02:00,COM VÍTIMA,AREIAS,AVENIDA,AVENIDA DR JOSE RUFINO,,,EM FRENTE AO CONDOMÍNIO MORADA DO BARRO,AREIAS,,,COLISÃO FRONTAL,1,1,0,0,0,0,0,0,0,1,0,,,,,,,,,,,,,
2023-05-04,quinta-feira ,06:26:00,SEM VÍTIMA,BOA VIAGEM,RUA,RUA WALDEMAR NERY CARNEIRO MONTEIRO,,,PROX A GALERIA CLARK E EM FRENTE AO EDF TANGARA N265,BOA VIAGEM,,,COLISÃO LATERAL,2,0,0,0,0,0,0,0,0,0,0,,,,,,,,,,,,,
2023-05-04,quinta-feira ,07:08:00,COM VÍTIMA,SANTO AMARO,AVENIDA,AVENIDA CRUZ CABUGA,,,DE FRENTE AO HOSP. SANTA CASA,SANTO AMARO,,,COLISÃO LATERAL,1,1,0,0,0,0,0,0,0,1,0,,,,,,,,,,,,,
2023-05-04,quinta-feira ,08:05:00,COM VÍTIMA,CAMPO GRANDE,RUA,RUA ESBERARD,RUA,RUA ODORICO MENDES,PRÓXIMO A CLUBE DAS PAZ,CAMPO GRANDE,,CIDADE,COLISÃO LATERAL,2,0,0,0,0,0,0,0,0,2,0,,,,,,,,,,,,,
2023-05-04,quinta-feira ,08:55:00,COM VÍTIMA,MACAXEIRA,AVENIDA,AVENIDA NORTE MIGUEL ARRAES DE ALENCAR,,,PROX AO TERMINAL DA MACAXEIRA,MACAXEIRA,,,COLISÃO TRASEIRA,0,1,0,0,0,1,0,0,0,2,0,,,,,,,,,,,,,
2023-05-04,quinta-feira ,10:07:00,SEM VÍTIMA,SAO JOSE,RUA,RUA DA CONCORDIA,RUA,RUA SAO JOAO,EM FRENTE BAZAR CARAMURU,SÃO JOSÉ,180,CIDADE,COLISÃO TRASEIRA,2,1,0,0,0,0,0,0,0,0,0,,,,,,,,,,,,,
2023-05-04,quinta-feira ,10:56:00,COM VÍTIMA,CAMPO GRANDE,RUA,RUA ODORICO MENDES,,,AO LADO CENTRAL DE FLAGRANTES,CAMPO GRANDE,,,COLISÃO FRONTAL,1,1,0,0,0,0,0,0,0,1,0,,,,,,,,,,,,,
2023-05-04,quinta-feira ,12:36:00,COM VÍTIMA,MADALENA,RUA,RUA JOSE OSORIO,,,APÓS O MERCADO DA MADALENA,MADALENA,,,COLISÃO LATERAL,0,0,0,0,0,0,0,0,0,1,0,,,,,,,,,,,,,
2023-05-04,quinta-feira ,04:51:00,SEM VÍTIMA,IBURA,AVENIDA,AVENIDA MARECHAL MASCARENHAS DE MORAES,,,EM FRENTE AO AEROPORTO/ SENTIDO PRAZERES,IBURA,,SUBURBIO,COLISÃO LATERAL,1,0,0,0,0,0,0,1,0,0,0,,,,,,,,,,,,,
2023-05-04,quinta-feira ,05:02:00,SEM VÍTIMA,BOA VIAGEM,RUA,RUA BRUNO VELOSO,,,AO LADO DO POSTO PETROBRAS,BOA VIAGEM,,CIDADE,,2,1,0,0,0,0,0,0,0,0,0,,,,,,,,,,,,,
2023-05-04,quinta-feira ,05:11:00,COM VÍTIMA,BOA VIAGEM,AVENIDA,AVENIDA ENGENHEIRO DOMINGOS FERREIRA,,,PROXIMO AO HOTEL VELA BRANCA,BOA VIAGEM,,,COLISÃO TRASEIRA,2,1,0,0,0,0,0,0,0,1,0,,,,,,,,,,,,,
2023-05-04,quinta-feira ,05:16:00,COM VÍTIMA,VARZEA,RUA,RUA RIBEIRO PESSOA,,,PROXIMO AO CONDOMINIO FICCOS BENJAMIN,VARZEA,,,COLISÃO FRONTAL,1,1,0,0,0,0,0,0,0,1,0,,,,,,,,,,,,,
2023-05-04,quinta-feira ,05:17:00,SEM VÍTIMA,JARDIM SAO PAULO,RUA,RUA LEANDRO BARRETO,,,ENCIMA DO VIADUTO DE JARDIM SÃO PAULO / PROX AO POSTO DE GASOLINA DE  IPIRANGA,JARDIM SAO PAULO,,,COLISÃO TRASEIRA,2,0,0,0,0,0,1,0,0,0,0,,,,,,,,,,,,,
2023-05-04,quinta-feira ,05:46:00,COM VÍTIMA,AGUA FRIA,EST,EST VELHA DE AGUA FRIA,,,E/F  AO MERCADO  DE AGUA FRIA  S/T BOMBA DO HEMETERIO,AGUA FRIA,,,COLISÃO LATERAL,0,1,0,0,0,1,0,0,0,1,0,,,,,,,,,,,,,
2023-05-04,quinta-feira ,06:30:00,COM VÍTIMA,PORTO DA MADEIRA,RUA,RUA DALVA DE OLIVEIRA,,,RUA AO LADO DA SEST SENAC,PORTO DA MADEIRA,,,COLISÃO LATERAL,1,1,0,0,0,0,0,0,0,2,0,,,,,,,,,,,,,
2023-05-05,sexta-feira ,07:21:00,COM VÍTIMA,CAMPO GRANDE,RUA,RUA JERONIMO VILELA,AVENIDA,AVENIDA PROFESSOR JOSE DOS ANJOS,SOB O SEMÁFORO,CAMPO GRANDE,642,,COLISÃO FRONTAL,0,1,0,0,0,0,1,0,0,1,0,,,,,,,,,,,,,
2023-05-05,sexta-feira ,07:31:00,SEM VÍTIMA,CORDEIRO,AVENIDA,AVENIDA CAXANGA,,,EM FRENTE A CENTROCAR,CORDEIRO,,CIDADE,COLISÃO TRASEIRA,1,0,0,0,0,0,0,1,0,0,0,,,,,,,,,,,,,
2023-05-05,sexta-feira ,08:21:00,COM VÍTIMA,BEBERIBE,AVENIDA,AVENIDA BEBERIBE,,,EM FRENTE A BORRACHARIA SÃO LUIZ,BEBERIBE,,,COLISÃO TRASEIRA,0,1,0,0,0,1,0,0,0,1,0,,,,,,,,,,,,,
2023-05-05,sexta-feira ,08:25:00,COM VÍTIMA,SANTO AMARO,AVENIDA,AVENIDA GOVERNADOR AGAMENON MAGALHAES,,,SENT. BOA VIAGEM APOS A FABRICA TACARUNA,SANTO AMARO,,,COLISÃO TRASEIRA,1,1,0,0,0,0,0,0,0,1,0,,,,,,,,,,,,,
2023-05-05,sexta-feira ,09:35:00,SEM VÍTIMA,TORROES,AVENIDA,AVENIDA ENGENHEIRO ABDIAS DE CARVALHO,,,LADO OPOSTO A CIA DA PEÇA,TORROES,,CIDADE,COLISÃO TRASEIRA,2,0,0,0,0,0,0,0,0,0,0,,,,,,,,,,,,,
2023-05-05,sexta-feira ,01:40:00,COM VÍTIMA,TAMARINEIRA,AVENIDA,AVENIDA CONS ROSA E SILVA,AVENIDA,AVENIDA DR MALAQUIAS,DEPOIS DO SHOPPING ETC,TAMARINEIRA,214,,COLISÃO LATERAL,1,1,0,0,0,0,0,0,0,1,0,,,,,,,,,,,,,
2023-05-05,sexta-feira ,01:33:00,COM VÍTIMA,CAXANGA,AVENIDA,AVENIDA CAXANGA,,,LADO OPSOTO AO TERMINAL DA CAXANGA,CAXANGA,,,COLISÃO TRASEIRA,1,1,0,0,0,0,0,0,0,1,0,,,,,,,,,,,,,
2023-05-05,sexta-feira ,03:47:00,SEM VÍTIMA,COQUEIRAL,RUA,RUA TUTOIA,,,FARMACIA PREÇO BOM,COQUEIRAL,,CIDADE,,1,0,0,0,0,0,0,1,0,0,0,,,,,,,,,,,,,
2023-05-05,sexta-feira ,05:57:00,COM VÍTIMA,TORRE,RUA,RUA JOAO TUDE DE MELO,,,LADO OPOSTO AO GUAIAMUM GIGANTE,TORRE,,,COLISÃO LATERAL,1,1,0,0,0,0,0,0,0,1,0,,,,,,,,,,,,,
2023-05-05,sexta-feira ,06:15:00,COM VÍTIMA,SAN MARTIN,RUA,RUA DELMIRO GOUVEIA,,,PROX A PRAÇA DA CHESF,SAN MARTIN,,,COLISÃO COM CICLISTA,1,0,0,1,0,0,0,0,0,1,0,,,,,,,,,,,,,
2023-05-05,sexta-feira ,06:47:00,COM VÍTIMA,BOA VIAGEM,AVENIDA,AVENIDA ENGENHEIRO DOMINGOS FERREIRA,,,CLINICAL CENTER,BOA VIAGEM,,,COLISÃO LATERAL,0,0,0,0,0,0,0,2,0,1,0,,,,,,,,,,,,,
2023-05-06,sábado ,09:26:00,COM VÍTIMA,AFOGADOS,EST,EST DOS REMEDIOS,,,EM FRENTE AO  TERMINAL DE ONIBUS AFOGADOS,AFOGADOS,,,COLISÃO COM CICLISTA,1,0,0,1,0,0,0,0,0,1,0,,,,,,,,,,,,,
2023-05-06,sábado ,05:24:00,COM VÍTIMA,AFOGADOS,RUA,RUA SAO MIGUEL,,,PROXIMO AO BODE DO NO,AFOGADOS,,,COLISÃO FRONTAL,1,1,0,0,0,0,0,0,0,1,0,,,,,,,,,,,,,
2023-05-06,sábado ,06:37:00,COM VÍTIMA,CASA AMARELA,AVENIDA,AVENIDA NORTE MIGUEL ARRAES DE ALENCAR,,,POSTO BR / ESPAÇO CAR / MATERNIDADE BARROS LIMA,CASA AMARELA,,,COLISÃO FRONTAL,1,1,0,0,0,0,0,0,0,1,0,,,,,,,,,,,,,
2023-05-06,sábado ,08:51:00,COM VÍTIMA,JARDIM SAO PAULO,RUA,RUA LEANDRO BARRETO,,,PRÓX. À PADARIA LA ROQUE,JARDIM SAO PAULO,,,COLISÃO FRONTAL,0,1,0,0,0,0,0,0,0,1,0,,,,,,,,,,,,,
2023-05-07,domingo ,06:55:00,VÍTIMA FATAL,DERBY,AVENIDA,AVENIDA GOVERNADOR AGAMENON MAGALHAES,PRC,PRC DO DERBY,PISTA LOCAL - SENTIDO BOA VIAGEM - E/F À ESTAÇÃO BRT,DERBY,,,ATROPELAMENTO DE PESSOA,1,0,0,0,1,0,0,0,0,0,1,,,,,,,,,,,,,
2023-05-07,domingo ,07:00:00,COM VÍTIMA,BOA VIAGEM,RUA,RUA DES JOAO PAES,RUA,RUA TENENTE DOMINGOS DE BRITO,PROX. A PADARIA ALEM DO PÃO,BOA VIAGEM,,,COLISÃO FRONTAL,1,1,0,0,0,0,0,0,0,1,0,,,,,,,,,,,,,
2023-05-07,domingo ,07:47:00,SEM VÍTIMA,BOA VIAGEM,RUA,RUA PADRE CARAPUCEIRO,AVENIDA,AVENIDA CELSO FURTADO (VIA MANGUE),PROX AO SHOPPING RECIFE E PROX AO SEMÁFORO 321,BOA VIAGEM,,CIDADE,COLISÃO LATERAL,3,0,0,0,0,0,0,0,0,0,0,,,,,,,,,,,,,
2023-05-07,domingo ,08:45:00,SEM VÍTIMA,ILHA DO LEITE,PTE,PTE JOSE DE BARROS LIMA,,,,ILHA DO LEITE,,JOANA BEZERRA/DERBY,CAPOTAMENTO,0,0,0,0,0,0,0,0,0,0,0,,,,,,,,,,,,,
2023-05-07,domingo ,10:21:00,COM VÍTIMA,VARZEA,RUA,RUA TORRES HOMEM,,,AO LADO DO RESIDENCIAL ATELIE LIFE,VARZEA,,,COLISÃO LATERAL,1,1,0,0,0,0,0,0,0,1,0,,,,,,,,,,,,,
2023-05-07,domingo ,12:11:00,COM VÍTIMA,IMBIRIBEIRA,AVENIDA,AVENIDA MARECHAL MASCARENHAS DE MORAES,RUA,RUA MIS JOEL CARLSON,LOGO APÓS A CAFESÓLIS,IMBIRIBEIRA,287,CIDADE,TOMBAMENTO,0,1,0,0,0,0,0,0,0,1,0,,,,,,,,,,,,,
2023-05-07,domingo ,05:05:00,COM VÍTIMA,CASA AMARELA,RUA,RUA PADRE LEMOS,,,E/F AO RESIDENCIAL  ROBERTO  ROSA BORGES,CASA AMARELA,,,COLISÃO LATERAL,1,1,0,0,0,0,0,0,0,1,0,,,,,,,,,,,,,
2023-05-07,domingo ,07:28:00,COM VÍTIMA,BOA VIAGEM,RUA,RUA SETUBAL,,,APÓS O PARQUE DONA LINDU,BOA VIAGEM,,CIDADE,COLISÃO FRONTAL,1,1,0,0,0,0,0,0,0,1,0,,,,,,,,,,,,,
2023-05-07,domingo ,07:36:00,COM VÍTIMA,CASA FORTE,AVENIDA,AVENIDA DEZESSETE DE AGOSTO,RUA,RUA MARQUES DE TAMANDARE,,CASA FORTE,,,COLISÃO TRANSVERSAL,1,1,0,0,0,0,0,0,0,1,0,,,,,,,,,,,,,
2023-05-08,segunda-feira ,05:27:00,SEM VÍTIMA,ARRUDA,AVENIDA,AVENIDA BEBERIBE,,,EM FRENTE AO CAMPO DO ARRUDA,ARRUDA,,,COLISÃO LATERAL,2,0,0,0,0,0,0,0,0,0,0,,,,,,,,,,,,,
2023-05-08,segunda-feira ,07:53:00,COM VÍTIMA,AREIAS,AVENIDA,AVENIDA RECIFE,,,NA DESCIDA DO VIADUTO, PROX. AO ATACADÃO,AREIAS,,,COLISÃO TRASEIRA,1,1,0,0,0,0,0,0,0,2,0,,,,,,,,,,,,
2023-05-08,segunda-feira ,09:53:00,COM VÍTIMA,CASA AMARELA,RUA,RUA JORGE DE ALBUQUERQUE,,,PROXIMO CENTRO MEDICO SENADOR ERMILIO DE MORAIS,CASA AMARELA,,,COLISÃO LATERAL,1,1,0,0,0,0,0,0,0,1,0,,,,,,,,,,,,,
2023-05-08,segunda-feira ,11:19:00,COM VÍTIMA,JORDAO,AVENIDA,AVENIDA JULIO CESAR,,,PROXIMO TERMINAL DA VAN,JORDAO,,,COLISÃO FRONTAL,0,1,0,0,1,0,0,0,0,1,0,,,,,,,,,,,,,
2023-05-08,segunda-feira ,11:40:00,COM VÍTIMA,IPUTINGA,AVENIDA,AVENIDA MAURICIO DE NASSAU,,,PROXIMO AO CAPELA SANTO ANTONIO,IPUTINGA,,,COLISÃO FRONTAL,1,0,0,0,1,0,0,0,0,1,0,,,,,,,,,,,,,
2023-05-08,segunda-feira ,03:23:00,COM VÍTIMA,SANTO AMARO,VIADUTO,VIADUTO ENG ROBERTO PEREIRA DE CARVALHO,,,AO LADO DO SHOPPING TACARUNA,SANTO AMARO,,,COLISÃO TRASEIRA,3,0,0,0,0,1,0,0,0,1,0,,,,,,,,,,,,,
2023-05-08,segunda-feira ,11:24:00,SEM VÍTIMA,CASA FORTE,AVENIDA,AVENIDA DEZESSETE DE AGOSTO,EST,EST DAS UBAIAS,,CASA FORTE,469,SUBURBIO,,1,1,0,0,0,0,0,0,0,0,0,,,,,,,,,,,,,
2023-05-09,terça-feira ,04:56:00,COM VÍTIMA,PRADO,AVENIDA,AVENIDA ENGENHEIRO ABDIAS DE CARVALHO,,,COM A RUA CARLOS GOMES,PRADO,,,COLISÃO TRANSVERSAL,3,1,0,0,0,0,0,0,0,1,0,,,,,,,,,,,,,
2023-05-09,terça-feira ,08:55:00,COM VÍTIMA,DOIS IRMAOS,RUA,RUA MANUEL DE MEDEIROS,,,PROX. A UPA,DOIS IRMAOS,,,COLISÃO TRASEIRA,1,1,0,0,0,0,0,0,0,1,0,,,,,,,,,,,,,
2023-05-09,terça-feira ,04:19:00,COM VÍTIMA,DOIS UNIDOS,RUA,RUA VILA FLOR,,,NO ALTO DO MARACANA NA RUA DA IGREJA ASSEMBLEIA DE DEUS,DOIS UNIDOS,,,ATROPELAMENTO DE PESSOA,0,0,0,0,1,0,1,0,0,1,0,,,,,,,,,,,,,
2023-05-09,terça-feira ,04:29:00,COM VÍTIMA,TAMARINEIRA,RUA,RUA VISCONDE DE ABAETE,,,PROX GALARIA NORTE CENTER,TAMARINEIRA,,,COLISÃO LATERAL,1,1,0,0,0,0,0,0,0,1,0,,,,,,,,,,,,,
2023-05-09,terça-feira ,04:52:00,SEM VÍTIMA,SANTO AMARO,AVENIDA,AVENIDA VISCONDE DE SUASSUNA,,,APÓS A ESCOLA DE ENFERMAGEM,SANTO AMARO,,,COLISÃO LATERAL,1,1,0,0,0,0,0,0,0,0,0,,,,,,,,,,,,,
2023-05-09,terça-feira ,11:08:00,COM VÍTIMA,CAXANGA,AVENIDA,AVENIDA CAXANGA,,,EM FRENTE AO TI GETÚLIO VARGAS. SENTIDO SUBURBIO.,CAXANGA,,SUBURBIO,COLISÃO TRASEIRA,0,1,0,0,0,0,0,0,0,2,0,,,,,,,,,,,,,
2023-05-10,quarta-feira ,07:32:00,COM VÍTIMA,SANTO AMARO,RUA,RUA DOS PALMARES,RUA,RUA AFONSO PENA,EM FRENTE AO RM,SANTO AMARO,,,COLISÃO LATERAL,1,2,0,0,0,0,0,0,0,2,0,,,,,,,,,,,,,
2023-05-10,quarta-feira ,07:53:00,COM VÍTIMA,DERBY,AVENIDA,AVENIDA GOVERNADOR AGAMENON MAGALHAES,RUA,RUA AMAURI DE MEDEIROS,,DERBY,,,QUEDA,0,1,0,0,0,0,0,0,0,1,0,,,,,,,,,,,,,
2023-05-10,quarta-feira ,07:58:00,COM VÍTIMA,IPSEP,RUA,RUA DO CANAL,,,DE ESQUINA COM MERCADINHO CONVENÇÃO,IPSEP,518,,COLISÃO FRONTAL,2,1,0,0,0,0,0,0,0,1,0,,,,,,,,,,,,,
2023-05-10,quarta-feira ,08:18:00,SEM VÍTIMA,TORRE,RUA,RUA JOSE BONIFACIO,RUA,RUA MARCOS ANDRE,CARREFOUR HIPERMERCADO TORRE,TORRE,487,,,1,0,0,0,0,0,1,0,0,0,0,,,,,,,,,,,,,
2023-05-10,quarta-feira ,10:23:00,COM VÍTIMA,TEJIPIO,AVENIDA,AVENIDA DR JOSE RUFINO,,,PROX. AO ARMAZEM CORAL,TEJIPIO,,,COLISÃO TRANSVERSAL,0,2,0,0,0,0,0,0,0,1,0,,,,,,,,,,,,,
2023-05-10,quarta-feira ,10:35:00,COM VÍTIMA,SAO JOSE,CAIS,CAIS SANTA RITA,,,ENTRADA DO CAIS DE SANTA RITA,SAO JOSE,76,,QUEDA,0,1,0,0,0,0,0,0,0,1,0,,,,,,,,,,,,,
2023-05-10,quarta-feira ,11:11:00,COM VÍTIMA,TAMARINEIRA,AVENIDA,AVENIDA NORTE MIGUEL ARRAES DE ALENCAR,EST,EST VELHA DE AGUA FRIA,CRUZAMENTO DAS VIAS,TAMARINEIRA,62,TORRE,COLISÃO LATERAL,0,2,0,0,0,0,0,0,0,1,0,,,,,,,,,,,,,
2023-05-10,quarta-feira ,11:16:00,SEM VÍTIMA,AFOGADOS,RUA,RUA SAO MIGUEL,,,EM FRENTE A FARMACIA DO TRABALHADOR  NA PRAÇA DE AFOGADOS,AFOGADOS,53,,COLISÃO LATERAL,2,0,0,0,0,0,1,0,0,0,0,,,,,,,,,,,,,
2023-05-10,quarta-feira ,03:01:00,SEM VÍTIMA,SANTO AMARO,AVENIDA,AVENIDA GOVERNADOR AGAMENON MAGALHAES,,,EM FRENTE AO Nº 1114,,,,,1,0,0,0,0,0,0,1,0,0,0,,,,,,,,,,,,,
2023-05-10,quarta-feira ,04:06:00,COM VÍTIMA,ARRUDA,AVENIDA,AVENIDA BEBERIBE,,,PROX AO ARMAZEM CANAL DA CONSTRUÇÃO,ARRUDA,64,,COLISÃO LATERAL,0,1,0,0,0,1,0,0,0,1,0,,,,,,,,,,,,,
2023-05-10,quarta-feira ,04:56:00,SEM VÍTIMA,ENGENHO DO MEIO,AVENIDA,AVENIDA VISCONDE DE SAO LEOPOLDO,,,EM FRENTE A IGREJA CRISTÃ GRAÇA E FÉ,ENGENHO DO MEIO,,,COLISÃO TRASEIRA,1,0,0,0,0,0,1,0,0,0,0,,,,,,,,,,,,,
2023-05-10,quarta-feira ,06:33:00,COM VÍTIMA,MADALENA,RUA,RUA BENFICA,,,AV VISCONDE DE ALBUQUERQUE,MADALENA,,,COLISÃO LATERAL,0,2,0,0,0,0,0,0,0,1,0,,,,,,,,,,,,,
2023-05-10,quarta-feira ,08:20:00,COM VÍTIMA,AFOGADOS,RUA,RUA SAO MIGUEL,,,EM FRENTE AO DEPATRI,AFOGADOS,,,COLISÃO LATERAL,1,1,0,0,0,0,0,0,0,1,0,,,,,,,,,,,,,
2023-05-11,quinta-feira ,07:59:00,COM VÍTIMA,MADALENA,AVENIDA,AVENIDA ENGENHEIRO ABDIAS DE CARVALHO,RUA,RUA JOAO IVO DA SILVA,PROXIMO A ANTIGA HABBIS,MADALENA,,,COLISÃO LATERAL,1,1,0,0,0,0,0,0,0,1,0,,,,,,,,,,,,,
2023-05-11,quinta-feira ,08:25:00,COM VÍTIMA,SAN MARTIN,AVENIDA,AVENIDA GENERAL SAN MARTIN,,,EM FRENTE A CHESF E PROXIMO AO HIPER,SAN MARTIN,,,COLISÃO FRONTAL,1,1,0,0,0,0,0,0,0,1,0,,,,,,,,,,,,,
2023-05-11,quinta-feira ,09:35:00,COM VÍTIMA,AFOGADOS,LARGO,LARGO DA PAZ,,,IGREJA LARGO DA PAZ,AFOGADOS,,,ATROPELAMENTO DE PESSOA,0,0,0,0,1,1,0,0,0,1,0,,,,,,,,,,,,,
2023-05-11,quinta-feira ,09:45:00,COM VÍTIMA,ILHA DO RETIRO,AVENIDA,AVENIDA ENGENHEIRO ABDIAS DE CARVALHO,,,,ILHA DO RETIRO,,,ATROPELAMENTO DE PESSOA,0,1,0,0,0,0,0,0,0,1,0,,,,,,,,,,,,,
2023-05-11,quinta-feira ,10:21:00,SEM VÍTIMA,AFOGADOS,RUA,RUA DA PAZ,,,EM FRENTE A IGREJA DA PAZ,AFOGADOS,,SUBURBIO,,2,0,0,0,0,0,1,0,0,0,0,,,,,,,,,,,,,
2023-05-11,quinta-feira ,11:25:00,SEM VÍTIMA,PAISSANDU,AVENIDA,AVENIDA GOVERNADOR AGAMENON MAGALHAES,,,REAL HOSPITAL PORTUGUÊS,PAISSANDU,69,SUBURBIO,,0,1,0,0,0,0,0,1,0,0,0,,,,,,,,,,,,,
2023-05-11,quinta-feira ,11:34:00,COM VÍTIMA,BARRO,AVENIDA,AVENIDA DR JOSE RUFINO,,,EM FRENTE AO COLEGIO EMACULADA DA CONCEIÇÃO,BARRO,,,ATROPELAMENTO DE PESSOA,0,1,0,0,1,0,0,0,0,1,0,,,,,,,,,,,,,
2023-05-11,quinta-feira ,06:11:00,COM VÍTIMA,ESPINHEIRO,RUA,RUA DR VICENTE MEIRA,RUA,RUA VIGARIO BARRETO,NA FRENTE DO EDIFICIO FIQUEIRAS,ESPINHEIRO,,,COLISÃO LATERAL,1,1,0,0,0,0,0,0,0,1,0,,,,,,,,,,,,,
2023-05-11,quinta-feira ,06:27:00,COM VÍTIMA,CASA FORTE,AVENIDA,AVENIDA DEZESSETE DE AGOSTO,RUA,RUA PIAUI,Centro Médico Sen. José Ermírio de Moraes,CASA FORTE,,,ATROPELAMENTO DE PESSOA,1,0,0,0,1,0,0,0,0,1,0,,,,,,,,,,,,,
2023-05-11,quinta-feira ,08:14:00,COM VÍTIMA,ESTANCIA,AVENIDA,AVENIDA RECIFE,,,NO VIADUTO PRÓXIMO AO AINTIGO MAKRO,ESTANCIA,,,COLISÃO FRONTAL,0,2,0,0,0,0,0,0,0,1,0,,,,,,,,,,,,,
2023-05-11,quinta-feira ,10:00:00,SEM VÍTIMA,IMBIRIBEIRA,AVENIDA,AVENIDA SUL,,,AO LADO DO RESIDENCIAL BOA VIAGEM,IMBIRIBEIRA,,,COLISÃO FRONTAL,3,0,0,0,0,0,0,0,0,0,0,,,,,,,,,,,,,
2023-05-11,quinta-feira ,10:40:00,COM VÍTIMA,IPUTINGA,AVENIDA,AVENIDA MAURICIO DE NASSAU,,,EM FRENTE AO MERCADO RENDE MAIS,IPUTINGA,,,COLISÃO FRONTAL,1,1,0,0,0,0,0,0,0,1,0,,,,,,,,,,,,,
2023-05-12,sexta-feira ,07:23:00,COM VÍTIMA,BOA VIAGEM,AVENIDA,AVENIDA CELSO FURTADO (VIA MANGUE),,,PROX ULTIMO FOTOSENSOR DO PINA SENTIDO BOA VIAGEM,BOA VIAGEM,,,COLISÃO TRASEIRA,1,1,0,0,0,0,0,0,0,1,0,,,,,,,,,,,,,
2023-05-12,sexta-feira ,07:38:00,COM VÍTIMA,BOA VIAGEM,RUA,RUA PROFESSOR JOAO MEDEIROS,,,POR TRAS DA DELEGACIA DE BOA VIAGEM,BOA VIAGEM,,,COLISÃO LATERAL,2,1,0,0,0,0,0,0,0,1,0,,,,,,,,,,,,,
2023-05-12,sexta-feira ,08:17:00,COM VÍTIMA,MADALENA,AVENIDA,AVENIDA ENGENHEIRO ABDIAS DE CARVALHO,,,PROX AO SPORT CLUBE DO RECIFE,MADALENA,,,COLISÃO TRASEIRA,2,2,0,0,0,0,0,0,0,3,0,,,,,,,,,,,,,
2023-05-12,sexta-feira ,08:29:00,COM VÍTIMA,CASA FORTE,AVENIDA,AVENIDA DEZESSETE DE AGOSTO,RUA,RUA MARQUES DE TAMANDARE,PROXIMO AO BARCHET NUMERO 1893,CASA FORTE,,,COLISÃO LATERAL,1,1,0,0,0,0,0,0,0,1,0,,,,,,,,,,,,,
2023-05-12,sexta-feira ,05:37:00,COM VÍTIMA,TORRE,RUA,RUA JOSE DE HOLANDA,,,EM FRENTE AO MAMUTE BEER,TORRE,,,COLISÃO TRASEIRA,1,1,0,0,0,0,0,0,0,1,0,,,,,,,,,,,,,
2023-05-12,sexta-feira ,05:46:00,COM VÍTIMA,MADALENA,RUA,RUA BARTOLOMEU DE GUSMAO,,,EM FRENTE A BARBEARIA BELEZA CAFÉ E MODA,MADALENA,,,ATROPELAMENTO DE PESSOA,1,0,0,0,1,0,0,0,0,1,0,,,,,,,,,,,,,
2023-05-12,sexta-feira ,06:44:00,COM VÍTIMA,DERBY,RUA,RUA JENER DE SOUZA,,,EM FRENTE AO QUARTEL DO DERBY,DERBY,,CIDADE,COLISÃO LATERAL,1,1,0,0,0,0,0,0,0,1,0,,,,,,,,,,,,,
2023-05-12,sexta-feira ,07:32:00,COM VÍTIMA,IPSEP,RUA,RUA JEAN EMILE FAVRE,TRV,TRV DOUTOR SABINO PINHO,PROX. A DELEGACIA,IPSEP,,,COLISÃO TRANSVERSAL,1,1,0,0,0,0,0,0,0,1,0,,,,,,,,,,,,,
2023-05-12,sexta-feira ,08:46:00,COM VÍTIMA,IBURA,AVENIDA,AVENIDA DOIS RIOS,,,EM FRENTE A IGREJA PRESBITERIANA,IBURA,443,,COLISÃO TRANSVERSAL,0,1,0,0,0,0,0,1,0,1,0,,,,,,,,,,,,,
2023-05-13,sábado ,02:31:00,VÍTIMA FATAL,SAN MARTIN,AVENIDA,AVENIDA ENGENHEIRO ABDIAS DE CARVALHO,,,PROX. COMPAZ,SAN MARTIN,687,CIDADE,COLISÃO TRANSVERSAL,1,1,0,0,0,0,0,0,0,1,1,,,,,,,,,,,,,
2023-05-13,sábado ,08:45:00,COM VÍTIMA,IMBIRIBEIRA,AVENIDA,AVENIDA MARECHAL MASCARENHAS DE MORAES,,,SENT. AEROPORTO, PROX. A ITALIANA,IMBIRIBEIRA,,,COLISÃO TRASEIRA,1,1,0,0,0,0,0,0,0,1,0,,,,,,,,,,,,
2023-05-13,sábado ,10:07:00,COM VÍTIMA,CASA FORTE,AVENIDA,AVENIDA DEZESSETE DE AGOSTO,,,NA FRENTE CLUBE 17,CASA FORTE,,,COLISÃO FRONTAL,1,1,0,0,0,0,0,0,0,1,0,,,,,,,,,,,,,
2023-05-13,sábado ,12:44:00,COM VÍTIMA,ARRUDA,AVENIDA,AVENIDA NORTE MIGUEL ARRAES DE ALENCAR,,,SOB O SEMAFORO,ARRUDA,364,,COLISÃO FRONTAL,0,1,0,0,1,0,0,0,0,2,0,,,,,,,,,,,,,
2023-05-13,sábado ,11:02:00,SEM VÍTIMA,SANTO ANTONIO,TRV,TRV DO ARSENAL DE GUERRA,,,,SANTO ANTONIO,,,CHOQUE,1,0,0,0,0,0,0,0,0,0,0,,,,,,,,,,,,,
2023-05-14,domingo ,01:51:00,VÍTIMA FATAL,IBURA,RUA,RUA DO CAMPO,,,TERMINAL DE ONIBUS DO UR-02,IBURA,,,ATROPELAMENTO DE PESSOA,0,0,0,0,1,0,0,0,0,0,1,,,,,,,,,,,,,
2023-05-14,domingo ,04:41:00,SEM VÍTIMA,TAMARINEIRA,RUA,RUA SAO VICENTE,,,EDF MANOEL JOAQUIM MEIRELES,TAMARINEIRA,,,CAPOTAMENTO,2,0,0,0,0,0,0,0,0,0,0,,,,,,,,,,,,,
2023-05-14,domingo ,04:12:00,COM VÍTIMA,SANTO AMARO,AVENIDA,AVENIDA GOVERNADOR AGAMENON MAGALHAES,,,EM FRENTE AO MINISTÉRIO DO TRABALHA,SANTO AMARO,,BOA VIAGEM,CHOQUE,1,1,0,0,0,0,0,0,0,1,0,,,,,,,,,,,,,
2023-05-14,domingo ,04:44:00,COM VÍTIMA,VARZEA,AVENIDA,AVENIDA CAXANGA,RUA,RUA GENERAL POLIDORO,EM FRENTE A FIAT ITALIANA,VARZEA,231,CIDADE,COLISÃO TRASEIRA,1,2,0,0,0,0,0,0,0,1,0,,,,,,,,,,,,,
2023-05-14,domingo ,06:10:00,COM VÍTIMA,ESTANCIA,AVENIDA,AVENIDA TAPAJOS,,,PROX A O POSTO DE GASOLINA PETROBRAS,ESTANCIA,,,COLISÃO FRONTAL,1,1,0,0,0,0,0,0,0,1,0,,,,,,,,,,,,,
2023-05-14,domingo ,07:48:00,SEM VÍTIMA,BEBERIBE,AVENIDA,AVENIDA BEBERIBE,,,EM FRENTE DA ACADEMIA DA CIDADE,BEBERIBE,388,SUBURBIO,COLISÃO TRANSVERSAL,2,0,0,0,0,0,0,0,0,0,0,,,,,,,,,,,,,
2023-05-15,segunda-feira ,09:45:00,SEM VÍTIMA,BOA VISTA,RUA,RUA DA AURORA,RUA,RUA DR SEBASTIAO LINS,AO LADO DO CINEMA SÃO LUIZ,BOA VISTA,,SUBURBIO,,1,1,0,0,0,0,0,0,0,0,0,,,,,,,,,,,,,
2023-05-15,segunda-feira ,09:59:00,COM VÍTIMA,IPSEP,AVENIDA,AVENIDA RECIFE,,,EM FRENTE A CARLOS EQUIPADORA,IPSEP,,,COLISÃO FRONTAL,1,1,0,0,0,0,0,0,0,1,0,,,,,,,,,,,,,
2023-05-15,segunda-feira ,11:56:00,SEM VÍTIMA,AFOGADOS,RUA,RUA COSME VIANA,,,EM FRENTE AO JP BIKE,AFOGADOS,,SUBURBIO,COLISÃO TRASEIRA,2,0,0,0,0,0,0,0,0,0,0,,,,,,,,,,,,,
2023-05-15,segunda-feira ,12:06:00,SEM VÍTIMA,SANTO AMARO,RUA,RUA AURORA,RUA,RUA DOIS DE JULHO,,SANTO AMARO,,CIDADE,,1,0,0,0,0,0,1,0,0,0,0,,,,,,,,,,,,,
